time,transcript
68:43,PHILLY BROWN ACROSS. BUT CAM NEWTON WAS UNDER SO MUCH
68:46,BUT CAM NEWTON WAS UNDER SO MUCH PRESSURE.
68:47,PRESSURE. HE HUNG IN THERE AS LONG AS HE
68:49,HE HUNG IN THERE AS LONG AS HE COULD AND THROWS IT A LITTLE OFF
68:50,COULD AND THROWS IT A LITTLE OFF THE MARK.
68:51,THE MARK. JIM: A BATTLE FOR THE FOOTBALL
68:54,JIM: A BATTLE FOR THE FOOTBALL BETWEEN TWO OLD OHIO STATE
68:56,BETWEEN TWO OLD OHIO STATE UNIVERSITY BUCKEYE TEAMMATES.
69:05,UNIVERSITY BUCKEYE TEAMMATES. NORWOOD.
69:09,NORWOOD. WATCHES THIS ONE BOUNCE INTO THE
69:10,"WATCHES THIS ONE BOUNCE INTO THE END ZONE AND A TOUCHBACK, FOR"
69:13,"END ZONE AND A TOUCHBACK, FOR ONLY A NET OF 41."
69:17,ONLY A NET OF 41. PEYTON'S FOURTH TIME IN THE
69:19,PEYTON'S FOURTH TIME IN THE SUPER BOWL WITH FOUR DIFFERENT
69:20,SUPER BOWL WITH FOUR DIFFERENT COACHES.
69:23,COACHES. WON IT WITH HALL OF FAMER TONY
69:26,WON IT WITH HALL OF FAMER TONY DUNGY.
69:27,"DUNGY. TONY, CONGRATULATIONS, FINDING"
69:29,"TONY, CONGRATULATIONS, FINDING OUT THE NEWS LAST NIGHT."
69:31,"OUT THE NEWS LAST NIGHT. JIM CALDWELL, LOST TO THE SAINTS"
69:32,"JIM CALDWELL, LOST TO THE SAINTS IN MIAMI IN THAT ONE."
69:35,IN MIAMI IN THAT ONE. AND THEN JOHN FOX TWO YEARS AGO.
69:38,AND THEN JOHN FOX TWO YEARS AGO. AND NOW GARY KUBIAK.
69:41,AND NOW GARY KUBIAK. PHIL: WE'VE DONE ALL THREE
69:43,"PHIL: WE'VE DONE ALL THREE PLAYOFF GAMES, OR THE FIRST TWO"
69:46,"PLAYOFF GAMES, OR THE FIRST TWO AND A HALF OF THE DENVER BRONCOS"
69:48,AND A HALF OF THE DENVER BRONCOS OFFENSE.
69:49,OFFENSE. PEYTON MANNING COMING BACK IN
69:51,"PEYTON MANNING COMING BACK IN WEEK 17, THE SECOND HALF, TO"
69:53,"WEEK 17, THE SECOND HALF, TO HELP THEM BEAT SAN DIEGO."
69:55,HELP THEM BEAT SAN DIEGO. THAT LAST THROW WAS PROBABLY HIS
69:57,THAT LAST THROW WAS PROBABLY HIS FIRST BAD DECISION WITH THE
69:59,FIRST BAD DECISION WITH THE FOOTBALL.
70:00,FOOTBALL. JIM: THOMAS FOR THE FIRST TIME
70:02,JIM: THOMAS FOR THE FIRST TIME AND HE CARRIES A COUPLE OF
70:04,AND HE CARRIES A COUPLE OF PANTHERS WITH HIM FOR A GAIN OF
70:05,PANTHERS WITH HIM FOR A GAIN OF EIGHT.
70:06,EIGHT. YOU SAW GARY KUBIAK OVER THERE.
70:09,YOU SAW GARY KUBIAK OVER THERE. AND HE WOULD BECOME THE FIRST TO
70:11,AND HE WOULD BECOME THE FIRST TO EVER WIN A SUPER BOWL AS A HEAD
70:13,EVER WIN A SUPER BOWL AS A HEAD COACH FOR A TEAM IN WHICH HE
70:16,COACH FOR A TEAM IN WHICH HE ALSO PLAYED.
70:17,ALSO PLAYED. PLAYED IN THREE SUPER BOWLS.
70:19,PLAYED IN THREE SUPER BOWLS. WAS 0-3 AS A PLAYER BUT HAS WON
70:22,WAS 0-3 AS A PLAYER BUT HAS WON THREE RINGS AS AN ASSISTANT.
70:24,THREE RINGS AS AN ASSISTANT. ONE IN SAN FRANCISCO.
70:26,ONE IN SAN FRANCISCO. TWO WITH MIKE SHANAHAN IN
70:27,TWO WITH MIKE SHANAHAN IN DENVER.
70:28,DENVER. SECOND AND AND THEY WRAP UP
70:31,SECOND AND AND THEY WRAP UP ANDERSON IN A HURRY.
70:32,ANDERSON IN A HURRY. A LOT OF PEOPLE DON'T KNOW
70:33,A LOT OF PEOPLE DON'T KNOW KUBIAK HAS THE HIGHEST
70:35,KUBIAK HAS THE HIGHEST COMPLETION PERCENTAGE FOR ANY
70:37,COMPLETION PERCENTAGE FOR ANY QUARTERBACK IN SUPER BOWL
70:38,QUARTERBACK IN SUPER BOWL HISTORY.
70:39,HISTORY. YOU ALWAYS HEAR ABOUT SOME GUY
70:40,YOU ALWAYS HEAR ABOUT SOME GUY WHO WENT 22-25?
70:42,WHO WENT 22-25? HE GOT OUTPLAYED IN THAT GAME BY
70:46,"HE GOT OUTPLAYED IN THAT GAME BY KUBIAK, WHO WENT 4-4."
70:48,"KUBIAK, WHO WENT 4-4. PHIL: GARY BROUGHT THAT UP TO US"
70:50,PHIL: GARY BROUGHT THAT UP TO US THE OTHER DAY AND STUCK IT RIGHT
70:51,THE OTHER DAY AND STUCK IT RIGHT TO ME.
70:52,TO ME. THAT WAS GOOD.
70:54,THAT WAS GOOD. JIM: I MIGHT HAVE TEED HIM UP A
70:56,JIM: I MIGHT HAVE TEED HIM UP A LITTLE BIT.
70:57,"LITTLE BIT. PHIL: WELL, MAYBE."
70:59,"PHIL: WELL, MAYBE. JIM: QUARTERBACK NUMBERS."
71:01,JIM: QUARTERBACK NUMBERS. MOST OF THESE COMPLETIONS OF THE
71:02,"MOST OF THESE COMPLETIONS OF THE SHORT VARIETY, AS WE APPROACH"
71:04,"SHORT VARIETY, AS WE APPROACH THE TWO-MINUTE MARK, SECOND"
71:07,"THE TWO-MINUTE MARK, SECOND QUARTER, AND A THIRD AND 2."
71:08,"QUARTER, AND A THIRD AND 2. THOMAS."
71:09,THOMAS. UNABLE TO GET OFF THE DEFENDER
71:10,UNABLE TO GET OFF THE DEFENDER IN TIME.
71:12,IN TIME. IT WAS NORMAN WHO WAS TANGLED UP
71:14,"IT WAS NORMAN WHO WAS TANGLED UP WITH HIM FOR A MOMENT AND AGAIN,"
71:16,"WITH HIM FOR A MOMENT AND AGAIN, DENVER'S OFFENSE STALLS."
71:19,DENVER'S OFFENSE STALLS. PHIL: IT'S THOMAS AGAINST JOSH
71:22,PHIL: IT'S THOMAS AGAINST JOSH NORMAN OUTSIDE AND ONCE AGAIN
71:25,NORMAN OUTSIDE AND ONCE AGAIN JOSH NORMAN WON.
71:27,JOSH NORMAN WON. JOSH NORMAN HAS HAD A TERRIFIC
71:30,JOSH NORMAN HAS HAD A TERRIFIC FIRST HALF FOR THE CAROLINA
71:31,FIRST HALF FOR THE CAROLINA DEFENSE.
71:32,DEFENSE. JIM: THE BRONCOS HAVE MISSED NOW
71:35,JIM: THE BRONCOS HAVE MISSED NOW ON THEIR LAST SEVEN THIRD DOWNS.
71:38,ON THEIR LAST SEVEN THIRD DOWNS. COLQUITT.
71:41,COLQUITT. THIS EARNS A FAIR CATCH FROM
71:43,THIS EARNS A FAIR CATCH FROM GINN.
71:44,GINN. BACK AT THE 19.
71:45,BACK AT THE 19. WITH LATIMER THERE JUST IN CASE.
71:48,WITH LATIMER THERE JUST IN CASE. MONITORING.
71:49,MONITORING. 53-YARD PUNT.
71:50,53-YARD PUNT. WE'RE AT THE TWO-MINUTE WARNING
71:52,WE'RE AT THE TWO-MINUTE WARNING AND
71:59,AND JIM: HERE'S A LOOK FROM OUR BUD
72:04,JIM: HERE'S A LOOK FROM OUR BUD LIGHT SKYCAM.
72:05,"LIGHT SKYCAM. JIM NANTZ WITH PHIL SIMMS, TRACY"
72:07,"JIM NANTZ WITH PHIL SIMMS, TRACY WOLFSON, EVAN WASHBURN, MIKE"
72:09,"WOLFSON, EVAN WASHBURN, MIKE CAREY AND JAY FEELY IF NEEDED"
72:12,CAREY AND JAY FEELY IF NEEDED FOR ANY SPECIAL TEAMS SITUATIONS
72:14,FOR ANY SPECIAL TEAMS SITUATIONS AND THIS IS WHAT RIVERA TALKED
72:16,AND THIS IS WHAT RIVERA TALKED TO US ABOUT THIS WEEK.
72:17,TO US ABOUT THIS WEEK. HE ALWAYS DEFERS.
72:20,HE ALWAYS DEFERS. THEY WON THE TOSS TODAY.
72:22,THEY WON THE TOSS TODAY. THOMAS DAVIS HAD SAID ALL WEEK
72:24,THOMAS DAVIS HAD SAID ALL WEEK I'M GOING TO CALL TAILS AND
72:26,I'M GOING TO CALL TAILS AND THAT'S WHAT IT CAME UP AND THEY
72:28,THAT'S WHAT IT CAME UP AND THEY WANTED THIS CHANCE FOR
72:29,WANTED THIS CHANCE FOR BACK-TO-BACK POSSESSIONS.
72:31,BACK-TO-BACK POSSESSIONS. TO CLOSE OUT THE FIRST HALF AND
72:32,TO CLOSE OUT THE FIRST HALF AND GET THE FOOTBALL TO START THE
72:34,GET THE FOOTBALL TO START THE THIRD.
72:37,THIRD. PHIL: THAT THEY'VE FOUND OUT
72:39,"PHIL: THAT THEY'VE FOUND OUT HERE TODAY, THE DENVER DEFENSE"
72:41,"HERE TODAY, THE DENVER DEFENSE SO FAR AGAINST CAROLINA'S"
72:42,"SO FAR AGAINST CAROLINA'S OFFENSE, DENVER'S DEFENSE IS AS"
72:44,"OFFENSE, DENVER'S DEFENSE IS AS GOOD AS ADVERTISED."
72:45,GOOD AS ADVERTISED. JIM: EACH TEAM WITH TWO
72:47,JIM: EACH TEAM WITH TWO TIME-OUTS.
72:56,TIME-OUTS. CAM.
72:59,CAM. GOOD PIECE OF TACKLING WILL --
73:03,"GOOD PIECE OF TACKLING WILL -- THERE BY CHRIS HARRIS, WHO"
73:04,"THERE BY CHRIS HARRIS, WHO MISSED THAT SUPER BOWL GAME TWO"
73:06,"MISSED THAT SUPER BOWL GAME TWO YEARS AGO, AS DID VON MILLER."
73:09,"YEARS AGO, AS DID VON MILLER. THEY BOTH HAD HAD LATE-SEASON"
73:11,"THEY BOTH HAD HAD LATE-SEASON A.C.L. INJURIES, SO THIS WAS"
73:14,"A.C.L. INJURIES, SO THIS WAS EXTRA SPECIAL FOR THOSE TWO."
73:16,EXTRA SPECIAL FOR THOSE TWO. PHIL: EVEN AS BIG AS CAM NEWTON
73:19,"PHIL: EVEN AS BIG AS CAM NEWTON IS, AGAINST THIS DEFENSE, WHEN"
73:20,"IS, AGAINST THIS DEFENSE, WHEN YOU START GOING SIDESWAYS, YOU"
73:22,"YOU START GOING SIDESWAYS, YOU ARE GOING DOWN."
73:23,ARE GOING DOWN. THEY'RE TOO FAST AND GREAT
73:25,THEY'RE TOO FAST AND GREAT TACKLERS.
73:26,TACKLERS. JIM: SECOND AND 7 AND NO PLAY.
73:32,JIM: SECOND AND 7 AND NO PLAY. DEREK WOLFE WAS ANOTHER DEFENDER
73:34,DEREK WOLFE WAS ANOTHER DEFENDER A COUPLE OF YEARS AGO WHO MISSED
73:36,A COUPLE OF YEARS AGO WHO MISSED THAT GAME AGAINST SEATTLE.
73:37,THAT GAME AGAINST SEATTLE. HE WAS OUT WITH ILLNESS.
73:42,"HE WAS OUT WITH ILLNESS. REFEREE: FALSE START, OFFENSE,"
73:45,"REFEREE: FALSE START, OFFENSE, NUMBER 73."
73:46,NUMBER 73. A FIVE-YARD PENALTY.
73:48,A FIVE-YARD PENALTY. REPLAY SECOND DOWN.
73:51,REPLAY SECOND DOWN. PLEASE PUT 1:26 ON THE GAME
73:53,PLEASE PUT 1:26 ON THE GAME CLOCK.
73:54,CLOCK. JIM: THESE ARE THE GUYS THAT
73:56,JIM: THESE ARE THE GUYS THAT THEY MISSED AND THEY GOT
73:58,"THEY MISSED AND THEY GOT THROTTLED, THE BRONCOS DID."
74:00,"THROTTLED, THE BRONCOS DID. CAME IN AS THIS OFFENSIVE"
74:03,CAME IN AS THIS OFFENSIVE JUGGERNAUT AND GOT BEAT 43-8 BY
74:06,JUGGERNAUT AND GOT BEAT 43-8 BY SEATTLE AND IMMEDIATELY JOHN
74:08,SEATTLE AND IMMEDIATELY JOHN ELWAY WENT OUT FOR REINFORCEMENT
74:11,"ELWAY WENT OUT FOR REINFORCEMENT ON THE DEFENSIVE SIDE, SIGNING"
74:13,"ON THE DEFENSIVE SIDE, SIGNING THE LIKES OF DEMARCUS WARE AND"
74:16,THE LIKES OF DEMARCUS WARE AND T.J. WARD.
74:17,T.J. WARD. PHIL: CAM NEWTON CHANGED THE
74:19,PHIL: CAM NEWTON CHANGED THE PLAY.
74:20,PLAY. THINKS IT'S A BLITZ.
74:21,THINKS IT'S A BLITZ. JIM: AQIB TALIB ALSO SIGNED
74:24,JIM: AQIB TALIB ALSO SIGNED AFTER THAT LOSS.
74:27,AFTER THAT LOSS. 1:25 TO GO IN THE HALF.
74:28,1:25 TO GO IN THE HALF. AND NEWTON'S PASS THROWN IN THE
74:31,AND NEWTON'S PASS THROWN IN THE AREA OF AGAIN.
74:34,AREA OF AGAIN. TALIB -- GINN.
74:35,TALIB -- GINN. TALIB IS JUMPING UP AND DOWN AS
74:38,TALIB IS JUMPING UP AND DOWN AS IF HE THOUGHT HE MIGHT HAVE BEEN
74:40,IF HE THOUGHT HE MIGHT HAVE BEEN ABLE TO MAKE A PLAY ON THAT
74:42,ABLE TO MAKE A PLAY ON THAT FOOTBALL.
74:43,FOOTBALL. PHIL: GOOD THROWAWAY THAT TIME.
74:45,PHIL: GOOD THROWAWAY THAT TIME. REALLY GOOD DISGUISE BY DENVER'S
74:47,REALLY GOOD DISGUISE BY DENVER'S DEFENSE.
74:48,DEFENSE. CAM NEWTON PROBABLY THOUGHT I'M
74:50,CAM NEWTON PROBABLY THOUGHT I'M GOING TO HAVE OLSEN ONE-ON-ONE
74:52,"GOING TO HAVE OLSEN ONE-ON-ONE BUT NO, VON MILLER DROPPED OUT"
74:53,"BUT NO, VON MILLER DROPPED OUT IN COVERAGE."
74:55,IN COVERAGE. DOUBLE COVERED THEIR BEST
74:57,DOUBLE COVERED THEIR BEST RECEIVER.
74:59,RECEIVER. NOWHERE TO THROW THE BALL.
75:01,"NOWHERE TO THROW THE BALL. JIM: SINCE THE TOUCHDOWN DRIVE,"
75:03,"JIM: SINCE THE TOUCHDOWN DRIVE, NEWTON HAS MISSED ON HIS LAST"
75:05,NEWTON HAS MISSED ON HIS LAST FIVE THROWS AND WATCH THESE TWO
75:07,"FIVE THROWS AND WATCH THESE TWO GUYS, READY TO POUNCE."
75:09,"GUYS, READY TO POUNCE. SIX --S OUT THERE AND A -- SIX"
75:14,SIX --S OUT THERE AND A -- SIX D.B.'S OUT THERE AND A TIME-OUT
75:15,D.B.'S OUT THERE AND A TIME-OUT CALLED BY CAM.
75:16,CALLED BY CAM. REFEREE: CAROLINA TAKES ITS
75:18,REFEREE: CAROLINA TAKES ITS SECOND TIME-OUT.
75:19,SECOND TIME-OUT. THIS IS A 30-SECOND TIME-OUT.
75:22,"THIS IS A 30-SECOND TIME-OUT. JIM: WELL, IN A LOT OF WAYS THIS"
75:24,"JIM: WELL, IN A LOT OF WAYS THIS IS WHAT YOU THOUGHT THE GAME"
75:26,"IS WHAT YOU THOUGHT THE GAME WOULD BE LIKE, THAT THE DEFENSES"
75:30,"WOULD BE LIKE, THAT THE DEFENSES WOULD STAR AND YOU HAVE THAT"
75:31,WOULD STAR AND YOU HAVE THAT PLAY BY MILLER RECOVERED BY
75:32,PLAY BY MILLER RECOVERED BY JACKSON FOR THE TOUCHDOWN.
75:34,JACKSON FOR THE TOUCHDOWN. PLUS YOU HAVE SPECIAL TEAMS
75:35,PLUS YOU HAVE SPECIAL TEAMS HERE.
75:36,HERE. NORWOOD WITH A LONG RETURN TO
75:37,"NORWOOD WITH A LONG RETURN TO SET UP A FIELD GOAL, A COUPLE OF"
75:40,"SET UP A FIELD GOAL, A COUPLE OF TURNOVERS OVERALL."
75:41,TURNOVERS OVERALL. FUMBLES BY THE PANTHERS.
75:43,FUMBLES BY THE PANTHERS. ONE PEYTON MANNING PASS
75:45,ONE PEYTON MANNING PASS INTERCEPTED.
75:46,INTERCEPTED. PHIL: IT'S A GAME OF MISCUES.
75:49,PHIL: IT'S A GAME OF MISCUES. YOU TURN IT AROUND TO THE OTHER
75:51,"YOU TURN IT AROUND TO THE OTHER SIDE, PEYTON MANNING THREW AN"
75:52,"SIDE, PEYTON MANNING THREW AN INTERCEPTION WHEN THEY'RE GOING"
75:54,INTERCEPTION WHEN THEY'RE GOING INTO MAYBE GET A CHANCE TO
75:55,INTO MAYBE GET A CHANCE TO SCORE.
75:57,SCORE. THEY GET A FOURTH DOWN PENALTY
75:59,"THEY GET A FOURTH DOWN PENALTY BY VASQUEZ, WHICH WAS INSIDE THE"
76:02,"BY VASQUEZ, WHICH WAS INSIDE THE 5-YARD LINE."
76:03,5-YARD LINE. SO BOTH TEAMS MAKING MISTAKES.
76:05,SO BOTH TEAMS MAKING MISTAKES. JIM: WHEN MANNING THREW THAT
76:07,"JIM: WHEN MANNING THREW THAT INTERCEPTION, THEY WERE IN FIELD"
76:09,"INTERCEPTION, THEY WERE IN FIELD GOAL RANGE AND WOULD HAVE HAD A"
76:10,GOAL RANGE AND WOULD HAVE HAD A CHANCE TO GO UP TWO SCORES.
76:14,CHANCE TO GO UP TWO SCORES. HERE'S A THIRD AND 12.
76:21,HERE'S A THIRD AND 12. DOWN THE FIELD AND PULLED DOWN.
76:24,DOWN THE FIELD AND PULLED DOWN. WHAT A CATCH.
76:27,WHAT A CATCH. THAT'S FUNCHESS.
76:29,THAT'S FUNCHESS. CLIMBS THE LADDER FOR 24.
76:33,CLIMBS THE LADDER FOR 24. PHIL: FOUR-MAN RUSH AND REALLY A
76:35,"PHIL: FOUR-MAN RUSH AND REALLY A TERRIFIC JOB BY CAM NEWTON,"
76:38,"TERRIFIC JOB BY CAM NEWTON, MOVING IN THE POCKETS TO GET THE"
76:39,MOVING IN THE POCKETS TO GET THE EXTRA TIME AND FINALLY FUNCHESS
76:41,EXTRA TIME AND FINALLY FUNCHESS GOT OPEN.
76:43,GOT OPEN. THE COVERAGE WAS OUTSTANDING UP
76:44,THE COVERAGE WAS OUTSTANDING UP TO THAT POINT.
76:45,TO THAT POINT. JIM: THE ROOKIE RECEIVER FROM
76:47,JIM: THE ROOKIE RECEIVER FROM MICHIGAN GIVES THEM THEIR
76:49,MICHIGAN GIVES THEM THEIR LONGEST PLAY OF THE GAME.
76:50,LONGEST PLAY OF THE GAME. OFF THE FINGERS TIP OF BROWN.
76:52,OFF THE FINGERS TIP OF BROWN. TALIB ON THE COVERAGE.
76:54,TALIB ON THE COVERAGE. PHIL: AND CAM NEWTON HAS
76:57,PHIL: AND CAM NEWTON HAS TREMENDOUS POCKET PRESENCE.
76:58,TREMENDOUS POCKET PRESENCE. FINALLY SEES FUNCHESS DOWN THE
77:00,FINALLY SEES FUNCHESS DOWN THE FIELD.
77:01,FIELD. RERIPPED IT OUT OF THE -- HE
77:06,RERIPPED IT OUT OF THE -- HE RIPPED IT OUT OF THE AIRPLANE.
77:09,RIPPED IT OUT OF THE AIRPLANE. LET ME HARP ON IT ONE MORE TIME.
77:11,LET ME HARP ON IT ONE MORE TIME. THE WIDE RECEIVERS.
77:13,THE WIDE RECEIVERS. THIS DENVER TRIO OF DEFENSIVE
77:15,"THIS DENVER TRIO OF DEFENSIVE BACKS, CHRIS HARRIS, AQIB TALIB,"
77:19,"BACKS, CHRIS HARRIS, AQIB TALIB, BRADLEY ROBY, THE BEST IN THE"
77:21,"BRADLEY ROBY, THE BEST IN THE LEAGUE."
77:22,LEAGUE. JIM: SECOND AND 10.
77:23,JIM: SECOND AND 10. THE PANTHERS WITH ONE TIME-OUT.
77:25,THE PANTHERS WITH ONE TIME-OUT. FROM THE 41 AND THE CATCH BY
77:27,FROM THE 41 AND THE CATCH BY OLSEN AND WARD ABLE TO SPIN HIM
77:29,OLSEN AND WARD ABLE TO SPIN HIM DOWN AFTER SEVEN.
77:38,DOWN AFTER SEVEN. CAROLINA NOT OPERATING WITH A
77:40,CAROLINA NOT OPERATING WITH A WHOLE LOT OF URGENCY HERE AS
77:41,WHOLE LOT OF URGENCY HERE AS THEY FACE A 24IRD AND 3.
77:43,THEY FACE A 24IRD AND 3. PHIL: THAT MIGHT BE THE REASON
77:45,PHIL: THAT MIGHT BE THE REASON WHY.
77:46,WHY. STILL TOO SLOW.
77:47,STILL TOO SLOW. SHOULD HAVE CALLED A TIME-OUT TO
77:49,SHOULD HAVE CALLED A TIME-OUT TO SAVE THE TIME.
77:50,SAVE THE TIME. JIM: NEWTON WILL KEEP IT AND
77:53,JIM: NEWTON WILL KEEP IT AND DRIVE AHEAD FOR THE FIRST DOWN
77:56,DRIVE AHEAD FOR THE FIRST DOWN AND THEN TIME-OUT CALLED BY
77:58,AND THEN TIME-OUT CALLED BY CAROLINA.
77:59,CAROLINA. THEIR LAST WITH 18 SECONDS
78:01,THEIR LAST WITH 18 SECONDS REMAINING.
78:05,"REMAINING. PHIL: I'LL SAY THIS, JIM, I'LL"
78:09,"PHIL: I'LL SAY THIS, JIM, I'LL ASK YOU, CAN HE KEEP THIS PACE"
78:12,"ASK YOU, CAN HE KEEP THIS PACE UP?"
78:13,UP? THE FACT IT'S ALL CAM NEWTON.
78:16,"THE FACT IT'S ALL CAM NEWTON. THE RUNNING PLAYS, STAYING IN"
78:21,"THE RUNNING PLAYS, STAYING IN THE POCKET, TAKING HITS?"
78:22,"THE POCKET, TAKING HITS? JIM: THIS IS SUCH A DYNAMIC"
78:24,JIM: THIS IS SUCH A DYNAMIC YOUNG TALENT THAT JUST WON THE
78:26,YOUNG TALENT THAT JUST WON THE M.V.P. AWARD.
78:27,M.V.P. AWARD. YOU HAVE TO THINK THAT THIS IS
78:30,YOU HAVE TO THINK THAT THIS IS NOT SOME SORT OF SUPER BOWL
78:31,NOT SOME SORT OF SUPER BOWL CAMEO FOR HIM.
78:33,CAMEO FOR HIM. YOU HAVE TO THINK CAM WILL BE
78:34,YOU HAVE TO THINK CAM WILL BE COMING BACK BUT HE HASN'T HAD A
78:37,COMING BACK BUT HE HASN'T HAD A WHOLE LOT OF REASON TO SMILE IN
78:39,WHOLE LOT OF REASON TO SMILE IN THIS FIRST HALF BECAUSE HE WEAR
78:41,THIS FIRST HALF BECAUSE HE WEAR THAT IS JOY OF PLAYING FOOTBALL
78:44,THAT IS JOY OF PLAYING FOOTBALL PRETTY WELL MOST OF THE TIME.
78:46,"PRETTY WELL MOST OF THE TIME. IN FACT, EARLIER -- EARLIER IN"
78:48,"IN FACT, EARLIER -- EARLIER IN THIS SERIES, HE WAS GRAMASING AS"
78:50,"THIS SERIES, HE WAS GRAMASING AS IF HE WAS EITHER EXHAUSTING OR"
78:52,IF HE WAS EITHER EXHAUSTING OR IN A LITTLE BIT OF PAIN.
78:54,IN A LITTLE BIT OF PAIN. PHIL: THAT WAS NOT A GOOD JOB OF
78:57,PHIL: THAT WAS NOT A GOOD JOB OF USING THEIR TIME HERE AT THE END
78:58,USING THEIR TIME HERE AT THE END OF THE FIRST HALF.
79:00,"OF THE FIRST HALF. JIM: WITH PRESSURE, BREAKS AWAY"
79:01,"JIM: WITH PRESSURE, BREAKS AWAY FROM MILLER AND GETS THE"
79:03,FROM MILLER AND GETS THE FOOTBALL DOWN THE FIELDIN
79:04,FOOTBALL DOWN THE FIELDIN COMPLETE.
79:10,COMPLETE. AGAIN HE WAS GOING BACK TO
79:13,AGAIN HE WAS GOING BACK TO OLSEN.
79:14,OLSEN. NOW DOWN TO 11 SECONDS.
79:16,NOW DOWN TO 11 SECONDS. PHIL: I KNOW AT HALFTIME THEY'RE
79:18,PHIL: I KNOW AT HALFTIME THEY'RE GOING TO COME UP WITH SOME NEW
79:21,GOING TO COME UP WITH SOME NEW THOUGHTS TO HELP THESE WIDE
79:23,THOUGHTS TO HELP THESE WIDE RECEIVERS GET OPEN DOWN THE
79:24,RECEIVERS GET OPEN DOWN THE FIELD.
79:25,FIELD. CAROLINA IS NOT A
79:26,CAROLINA IS NOT A RHYTHM-THROWING OFFENSE.
79:28,"RHYTHM-THROWING OFFENSE. IN OTHER WORDS, HE'S NOT GOING"
79:29,"IN OTHER WORDS, HE'S NOT GOING TO THROW A BUNCH OF SHORT"
79:31,TO THROW A BUNCH OF SHORT PASSES.
79:32,PASSES. USUALLY HE HOLDS ONTO THE
79:34,"USUALLY HE HOLDS ONTO THE FOOTBALL, GIVES RECEIVERS PLENTY"
79:36,"FOOTBALL, GIVES RECEIVERS PLENTY OF TIME TO GET OPEN BUT NOT"
79:37,OF TIME TO GET OPEN BUT NOT DOING IT HERE IN THIS GAME SO
79:39,DOING IT HERE IN THIS GAME SO FAR.
79:40,FAR. JIM: SECOND AND 10 AND THAT WILL
79:42,JIM: SECOND AND 10 AND THAT WILL CLOSE OUT THE HALF AS DEMARCUS
79:47,CLOSE OUT THE HALF AS DEMARCUS WARE PILE DRIVES CAM NEWTON TO
79:50,WARE PILE DRIVES CAM NEWTON TO THE GROUND.
80:00,THE GROUND. PHIL: ON THE OUTSIDE.
80:02,PHIL: ON THE OUTSIDE. HE TALKED TO US ABOUT IT THE
80:05,"HE TALKED TO US ABOUT IT THE OTHER DAY, HAS WORKED ON IT SO"
80:07,"OTHER DAY, HAS WORKED ON IT SO HARD."
80:08,HARD. HAS GOTTEN BETTER AT BENDING THE
80:10,HAS GOTTEN BETTER AT BENDING THE CORNER.
80:11,CORNER. JIM: HE MISSED ALL OF THOSE
80:12,"JIM: HE MISSED ALL OF THOSE GAMES BECAUSE OF INJURY, BACK"
80:14,"GAMES BECAUSE OF INJURY, BACK INJURY."
80:15,INJURY. HE SAID IT WAS THE BEST THING
80:16,HE SAID IT WAS THE BEST THING THAT HAPPENED TO ME.
80:18,THAT HAPPENED TO ME. I DID MORE CORE TRAINING THAN
80:20,I DID MORE CORE TRAINING THAN EVER AND I'M ABLE TO GET LOWER
80:23,EVER AND I'M ABLE TO GET LOWER INTO THE QUARTERBACK FASTER THAN
80:24,INTO THE QUARTERBACK FASTER THAN I COULD.
80:25,I COULD. LET'S GO TO EVAN.
80:27,LET'S GO TO EVAN. EVAN: HERE WITH HEAD COACH
80:29,EVAN: HERE WITH HEAD COACH RIVERA.
80:30,RIVERA. THEIR PRESSURE HAD AN IMPACT ON
80:34,THEIR PRESSURE HAD AN IMPACT ON THE LAST PLAY.
80:35,THE LAST PLAY. HOW DO YOU CHANGE THINGS IN THE
80:37,HOW DO YOU CHANGE THINGS IN THE SECOND HALF?
80:39,SECOND HALF? RON: WE CAN'T TURN THE BALL OVER
80:41,RON: WE CAN'T TURN THE BALL OVER AND WE GET CHANCES TO MAKE
80:43,"AND WE GET CHANCES TO MAKE PLAYS, WE HAVE TO MAKE PLAYS."
80:45,"PLAYS, WE HAVE TO MAKE PLAYS. EVAN: WHAT DO YOU THINK THIS"
80:47,EVAN: WHAT DO YOU THINK THIS GAME WILL COME DOWN TO?
80:49,GAME WILL COME DOWN TO? RON: I THINK IT'S GOING TO END
80:51,RON: I THINK IT'S GOING TO END UP WITH THE TEAM WHO HAS THE
80:53,UP WITH THE TEAM WHO HAS THE BALL LAST.
80:54,BALL LAST. JIM: HIS QUARTERBACK GOT SACKED
80:56,JIM: HIS QUARTERBACK GOT SACKED FOUR TIMES IN THAT FIRST HALF.
80:58,FOUR TIMES IN THAT FIRST HALF. ONE LED TO THE BRONCOS' ONLY
80:59,ONE LED TO THE BRONCOS' ONLY TOUCHDOWN WITH THE RECOVERY BY
81:01,TOUCHDOWN WITH THE RECOVERY BY MALIK JACKSON.
81:02,"MALIK JACKSON. COMING UP, STAY TUNED FOR A ONCE"
81:04,"COMING UP, STAY TUNED FOR A ONCE IN A LIFETIME PERFORMANCE FROM"
81:08,IN A LIFETIME PERFORMANCE FROM COLDPLAY WITH OTHER GUEST STARS
81:10,COLDPLAY WITH OTHER GUEST STARS AT THE PEPSI SUPER BOWL 50
81:12,AT THE PEPSI SUPER BOWL 50 HALFTIME SHOW.
81:13,HALFTIME SHOW. THAT'S THE END OF THE FIRST HALF
81:17,THAT'S THE END OF THE FIRST HALF WITH THE SCORE DENVER 13 AND
81:18,WITH THE SCORE DENVER 13 AND CAROLINA 7.
81:19,"CAROLINA 7. WE'RE BACK WITH THE ""THE JEEP"
81:21,"WE'RE BACK WITH THE ""THE JEEP SUPER BOWL HALFTIME REPORT"""
81:23,"SUPER BOWL HALFTIME REPORT"" AFTER THIS MESSAGE AND A WORD"
81:24,AFTER THIS MESSAGE AND A WORD FROM YOUR LOCAL STATION.
81:25,FROM YOUR LOCAL STATION. YOU'RE WATCHING SUPER BOWL 50 ON
81:28,YOU'RE WATCHING SUPER BOWL 50 ON CBS.
81:39,JIM: THE 50TH SUPER BOWL
81:41,JIM: THE 50TH SUPER BOWL COMMENCES.
81:43,COMMENCES. BALL IS OUT AND IT'S RECOVERED
81:44,BALL IS OUT AND IT'S RECOVERED FOR THE TOUCHDOWN.
81:45,FOR THE TOUCHDOWN. VON MILLER WITH THE STRIP SACK.
81:47,VON MILLER WITH THE STRIP SACK. AND STEWART UP AND IN WITH A
81:50,AND STEWART UP AND IN WITH A CAROLINA TOUCHDOWN.
81:51,CAROLINA TOUCHDOWN. AND HE FUMBLES AND TREVATHAN IS
81:53,AND HE FUMBLES AND TREVATHAN IS THERE WITH A RECOVERY.
81:54,THERE WITH A RECOVERY. ANOTHER MISTAKE MADE BY
81:56,ANOTHER MISTAKE MADE BY CAROLINA.
82:00,CAROLINA. BAY AREA LEGEND CARLOS SANTANA
82:04,BAY AREA LEGEND CARLOS SANTANA WELCOMING US BACK TO SUPER BOWL
82:06,WELCOMING US BACK TO SUPER BOWL 50.
82:07,50. AND LET'S TAKE A LOOK AT THE CBS
82:10,AND LET'S TAKE A LOOK AT THE CBS EYE VISION 360 POWERED BY INTEL.
82:18,"EYE VISION 360 POWERED BY INTEL. PHIL: JONATHAN STEWART, HOW"
82:19,"PHIL: JONATHAN STEWART, HOW ABOUT THAT?"
82:21,ABOUT THAT? THAT MIGHT BE THE WAVE OF THE
82:22,THAT MIGHT BE THE WAVE OF THE FUTURE.
82:23,FUTURE. JIM: THAT COULD BE SOME
82:25,JIM: THAT COULD BE SOME TECHNOLOGY THAT COULD BE VERY
82:28,TECHNOLOGY THAT COULD BE VERY USEFUL DETERMINING DID THEY
82:30,USEFUL DETERMINING DID THEY CROSS THE PLANE DOWN THE ROAD.
82:32,CROSS THE PLANE DOWN THE ROAD. THAT WAS THE TOUCHDOWN ROAD FOR
82:33,THAT WAS THE TOUCHDOWN ROAD FOR THE PANTHERS WHERE THEY AMASSED
82:36,THE PANTHERS WHERE THEY AMASSED 73 OF THEIR 140.
82:38,73 OF THEIR 140. GOT MORE THAN HALF THEIR YARDAGE
82:41,GOT MORE THAN HALF THEIR YARDAGE ON THAT ONE SERIES.
82:42,"ON THAT ONE SERIES. OTHER THAN THAT, THE DENVER"
82:44,"OTHER THAN THAT, THE DENVER DEFENSE HAS BEEN STOUT IN"
82:46,DEFENSE HAS BEEN STOUT IN HOLDING THE HIGHEST SCORING TEAM
82:47,HOLDING THE HIGHEST SCORING TEAM IN FOOTBALL TO ONLY SEVEN
82:50,IN FOOTBALL TO ONLY SEVEN POINTS.
82:51,POINTS. PHIL: PROBABLY ONE TIME BOTH
82:53,PHIL: PROBABLY ONE TIME BOTH TEAMS VERY HAPPY FOR THE EXTRA
82:54,TEAMS VERY HAPPY FOR THE EXTRA TIME TO REST AT HALF TIME.
82:55,TIME TO REST AT HALF TIME. THEY NEEDED IT.
82:57,THEY NEEDED IT. JIM: THE KICK TO WHITTAKER.
83:00,JIM: THE KICK TO WHITTAKER. HE'LL TAKE A KNEE.
83:02,HE'LL TAKE A KNEE. THERE HAVE BEEN 11 TIMES --
83:04,THERE HAVE BEEN 11 TIMES -- TIMES BEFORE THIS WEEK WHEN THE
83:06,TIMES BEFORE THIS WEEK WHEN THE NUMBER ONE DEFENSE MADE IT TO
83:08,NUMBER ONE DEFENSE MADE IT TO THE SUPER BOWL AND THE TEAM WITH
83:10,THE SUPER BOWL AND THE TEAM WITH THE NUMBER ONE DEFENSE WON NINE
83:12,THE NUMBER ONE DEFENSE WON NINE OF THOSE.
83:13,OF THOSE. PHIL: GOOD PITCHING BEATS GOOD
83:16,PHIL: GOOD PITCHING BEATS GOOD HITTING AND CAROLINA'S DEFENSE
83:17,"HITTING AND CAROLINA'S DEFENSE COULDN'T BLOCK THE EDGE RUSHERS,"
83:20,"COULDN'T BLOCK THE EDGE RUSHERS, COULDN'T GET RECEIVERS OPEN."
83:21,COULDN'T GET RECEIVERS OPEN. CAROLINA HAS TO CHANGE SOME
83:23,CAROLINA HAS TO CHANGE SOME THINGS ON THE OFFENSIVE SIDE.
83:25,THINGS ON THE OFFENSIVE SIDE. KEEP EXTRA GUYS IN TO BLOCK TO
83:27,KEEP EXTRA GUYS IN TO BLOCK TO GIVE CAM NEWTON MORE TIME AND
83:30,GIVE CAM NEWTON MORE TIME AND MAYBE GIVE THE WIDE RECEIVERS AN
83:32,MAYBE GIVE THE WIDE RECEIVERS AN EXTRA BEAT TO GET OPEN DOWN THE
83:35,EXTRA BEAT TO GET OPEN DOWN THE FIELD.
83:36,FIELD. JIM: CONTACT RIGHT AWAY AT THE
83:38,JIM: CONTACT RIGHT AWAY AT THE LINE OF SCRIMMAGE AND THEY PUSH
83:40,LINE OF SCRIMMAGE AND THEY PUSH BACK JONATHAN STEWART.
83:41,BACK JONATHAN STEWART. IT WILL BE NO GAIN.
83:43,IT WILL BE NO GAIN. STEWART NOW WITH SEVEN CARRIES
83:45,STEWART NOW WITH SEVEN CARRIES FOR SEVEN YARDS IN THE GAME.
83:47,FOR SEVEN YARDS IN THE GAME. AND HERE ARE THE NUMBERS.
83:53,AND HERE ARE THE NUMBERS. PHIL: LOOK AT THAT.
83:54,PHIL: LOOK AT THAT. NEITHER TEAM CAN THROW THE
83:56,NEITHER TEAM CAN THROW THE FOOTBALL.
83:57,"FOOTBALL. PATS PROTECTION, COVERAGE."
83:59,"PATS PROTECTION, COVERAGE. LOTS OF REASONS FOR THAT WE WERE"
84:02,LOTS OF REASONS FOR THAT WE WERE THINKING MAYBE THE FIRST TEAM TO
84:04,THINKING MAYBE THE FIRST TEAM TO 24 WAS GOING TO WIN THE GAME.
84:06,24 WAS GOING TO WIN THE GAME. THAT'S WHAT OUR THOUGHT WAS
84:08,THAT'S WHAT OUR THOUGHT WAS BEFORE BUT I THINK WE SHOULD
84:11,BEFORE BUT I THINK WE SHOULD LOWING THAT SOME AFTER THAT
84:12,LOWING THAT SOME AFTER THAT FIRST HALF.
84:13,FIRST HALF. THE SPEED OF DENVER'S DEFENSE
84:15,THE SPEED OF DENVER'S DEFENSE OVERWHELMING CAM NEWTON.
84:16,OVERWHELMING CAM NEWTON. JIM: SECOND AND 10 AND DOWN THE
84:19,"JIM: SECOND AND 10 AND DOWN THE MIDDLE, HE'S GOT GINN, WHO'S GOT"
84:21,"MIDDLE, HE'S GOT GINN, WHO'S GOT SPEED!"
84:22,SPEED! AND HE IS OUT OF BOUNDS AT THE
84:23,AND HE IS OUT OF BOUNDS AT THE 35 OF THE BRONCOS.
84:26,35 OF THE BRONCOS. TED GINN WITH HIS FIRST CATCH OF
84:27,"TED GINN WITH HIS FIRST CATCH OF THE NIGHT AND IT'S A BIG ONE,"
84:30,"THE NIGHT AND IT'S A BIG ONE, FOR 45 YARDS."
84:31,FOR 45 YARDS. LONGEST PLAY OF THE GAME.
