time,transcript
33:07,KUECHLY JUST SO FAST. TIMED IT PERFECTLY TOO.
33:09,TIMED IT PERFECTLY TOO. JIM: HIS POSTSEASON PLAY JUST A
33:12,JIM: HIS POSTSEASON PLAY JUST A HUGE HIGHLIGHT REEL WITH PICK
33:15,"HUGE HIGHLIGHT REEL WITH PICK SIXES IN BOTH GAMES, THE FIRST"
33:20,"SIXES IN BOTH GAMES, THE FIRST IN POSTSEASON HISTORY TO HAVE"
33:21,IN POSTSEASON HISTORY TO HAVE BACK-TO-BACK GAMES WITH
33:23,BACK-TO-BACK GAMES WITH INTERCEPTION RETURNS FOR
33:24,INTERCEPTION RETURNS FOR TOUCHDOWNS.
33:25,TOUCHDOWNS. AND HERE'S THE RETURN TRY WITH A
33:26,AND HERE'S THE RETURN TRY WITH A FLAG OUT AGAIN.
33:30,FLAG OUT AGAIN. GETS SPUN AROUND AT ABOUT THE
33:32,GETS SPUN AROUND AT ABOUT THE 41.
33:33,"41. PHIL: THEY GOT WHAT THEY WANTED,"
33:35,"PHIL: THEY GOT WHAT THEY WANTED, A GOOD DEFENSIVE STAND TO GET"
33:38,A GOOD DEFENSIVE STAND TO GET FIELD POSITION FOR THEIR OFFENSE
33:39,FIELD POSITION FOR THEIR OFFENSE AND ANOTHER MISTAKE BY CAROLINA.
33:47,"AND ANOTHER MISTAKE BY CAROLINA. REFEREE: DURING THE RETURN,"
33:49,"REFEREE: DURING THE RETURN, ILLEGAL BLOCK IN THE BACK,"
33:52,"ILLEGAL BLOCK IN THE BACK, RETURN TEAM NUMBER 21."
33:53,RETURN TEAM NUMBER 21. A 10-YARD PENALTY FROM THE SPOT
33:55,A 10-YARD PENALTY FROM THE SPOT OF THE FOUL.
33:56,"OF THE FOUL. FIRST DOWN, CAROLINA."
34:03,"FIRST DOWN, CAROLINA. JIM: THESE TWO QUARTERBACKS,"
34:05,"JIM: THESE TWO QUARTERBACKS, BOTH OVERALL NUMBER ONE PICKS,"
34:08,"BOTH OVERALL NUMBER ONE PICKS, 13 YEARS SEPARATE THE TWO."
34:10,13 YEARS SEPARATE THE TWO. IT'S THE LARGEST AGE MARGIN FOR
34:12,IT'S THE LARGEST AGE MARGIN FOR STARTING QUARTERBACKS IN ANY
34:15,STARTING QUARTERBACKS IN ANY SUPER BOWL GAME.
34:16,SUPER BOWL GAME. NEWTON COMING IN WITH 50 TOTAL
34:20,"NEWTON COMING IN WITH 50 TOTAL TOUCHDOWNS, REGULAR AND"
34:21,"TOUCHDOWNS, REGULAR AND POSTSEASON, RUSHING AND PASSING"
34:23,"POSTSEASON, RUSHING AND PASSING ON THE YEAR."
34:24,ON THE YEAR. THAT 50 NUMBER.
34:27,THAT 50 NUMBER. HE HAD 50 TOUCHDOWNS HE
34:30,HE HAD 50 TOUCHDOWNS HE ACCOUNTED FOR AUBURN HIS SENIOR
34:33,ACCOUNTED FOR AUBURN HIS SENIOR YEAR WHEN HE LED THEM TO A
34:35,YEAR WHEN HE LED THEM TO A NATIONAL TITLE.
34:36,NATIONAL TITLE. AND THE 50 NUMBER POPS IT -- UP
34:40,AND THE 50 NUMBER POPS IT -- UP AGAIN IN THIS GAME.
34:41,AGAIN IN THIS GAME. THAT WAS SHAKY ON THE GIVE TO
34:44,"THAT WAS SHAKY ON THE GIVE TO STEWART, WHO RETURNS BUT GIVES"
34:45,"STEWART, WHO RETURNS BUT GIVES BACK A YARD."
34:46,"BACK A YARD. PHIL: YOU'RE RIGHT, NEWTON RYE"
34:49,"PHIL: YOU'RE RIGHT, NEWTON RYE TRYING TO HANG ON TO THAT"
34:51,TRYING TO HANG ON TO THAT FOOTBALL AS LONG AS HE CAN.
34:53,FOOTBALL AS LONG AS HE CAN. SO FAR THIS DENVER DEFENSE JUST
34:54,SO FAR THIS DENVER DEFENSE JUST TOO FAST.
34:55,TOO FAST. NICE RECOVERY THERE BY STEWART.
34:58,NICE RECOVERY THERE BY STEWART. THE FOOTBALL LOOKED LIKE IT WAS
34:59,THE FOOTBALL LOOKED LIKE IT WAS OUT.
35:00,OUT. TOO FAST TO BE BLOCKED RIGHT NOW
35:01,TOO FAST TO BE BLOCKED RIGHT NOW BY THE CAROLINA OFFENSE.
35:03,"BY THE CAROLINA OFFENSE. JIM: STEWART, THREE CARRIES, TWO"
35:06,"JIM: STEWART, THREE CARRIES, TWO YARDS."
35:07,YARDS. SECOND AND 11.
35:08,"SECOND AND 11. LAST MINUTE, QUARTER NUMBER ONE."
35:10,"LAST MINUTE, QUARTER NUMBER ONE. TIME FOR NEWTON TO THROW AND"
35:12,TIME FOR NEWTON TO THROW AND HE'S GOT BILLY -- FILLY BROWN ON
35:22,HE'S GOT BILLY -- FILLY BROWN ON THE SIDELINES.
35:23,THE SIDELINES. BIG GAIN FOR THE PANTHERS.
35:29,BIG GAIN FOR THE PANTHERS. PHIL: NICE THROW THAT TIME BY
35:31,PHIL: NICE THROW THAT TIME BY CAM NEWTON.
35:32,CAM NEWTON. THEY'RE GOING TO HAVE A LOT OF
35:34,THEY'RE GOING TO HAVE A LOT OF THOSE SITUATIONS.
35:35,"THOSE SITUATIONS. OUTSIDE, ONE-ON-ONE."
35:36,"OUTSIDE, ONE-ON-ONE. CAN THEY MAKE THE THROW AND"
35:39,CAN THEY MAKE THE THROW AND CATCH?
35:40,CATCH? JIM: PHILLY BROWN WITH A CATCH
35:42,JIM: PHILLY BROWN WITH A CATCH FOR 20.
35:44,FOR 20. PANTHERS HAD A TOTAL OF NINE
35:48,PANTHERS HAD A TOTAL OF NINE YARDS IN THE AIR BEFORE THAT
35:50,YARDS IN THE AIR BEFORE THAT CATCH.
35:55,CATCH. THAT'S GOING TO CLOSE OUT THE
35:57,THAT'S GOING TO CLOSE OUT THE QUARTER.
35:59,QUARTER. THAT'S THE END OF THE FIRST
36:03,THAT'S THE END OF THE FIRST QUARTER WITH THE BRONCOS LEADING
36:04,QUARTER WITH THE BRONCOS LEADING IT 10-0.
36:05,IT 10-0. WE'LL RETURN AFTER THESE
36:07,WE'LL RETURN AFTER THESE MESSAGES.
36:16,JIM: THE FIRST QUARTER FOR
36:19,JIM: THE FIRST QUARTER FOR CAROLINA THAT DIDN'T FEEL
36:20,CAROLINA THAT DIDN'T FEEL ANYTHING LIKE WHAT THEY HAD
36:22,ANYTHING LIKE WHAT THEY HAD EXPERIENCED IN THE N.F.C. TITLE
36:26,EXPERIENCED IN THE N.F.C. TITLE GAME AND THE GIGSAL ROUND.
36:29,GAME AND THE GIGSAL ROUND. SECOND QUARTER BEGINS AND CAM IS
36:33,SECOND QUARTER BEGINS AND CAM IS TEAN TAKING OFF.
36:34,TEAN TAKING OFF. RIGHT THERE NEAR THE FIRST DOWN.
36:36,"RIGHT THERE NEAR THE FIRST DOWN. HE SLIDES, GAVE HIMSELF UP SO"
36:39,"HE SLIDES, GAVE HIMSELF UP SO THEY'RE GOING TO GET HIM TO COME"
36:40,THEY'RE GOING TO GET HIM TO COME BACK.
36:41,BACK. IT'S GOING TO BE A GAME OF 10 OR
36:44,IT'S GOING TO BE A GAME OF 10 OR 11.
36:48,11. PHIL: YOU HAVE TO BE DISCIPLINED
36:50,PHIL: YOU HAVE TO BE DISCIPLINED ON THE DEFENSIVE SIDE WHEN
36:51,ON THE DEFENSIVE SIDE WHEN YOU'RE GOING TO COME AND BLITZ.
36:53,YOU'RE GOING TO COME AND BLITZ. SOMEBODY HAS TO BE SPYING THE
36:56,SOMEBODY HAS TO BE SPYING THE QUARTERBACK.
36:57,QUARTERBACK. JIM: THIS RUN GOES FOR A FIRST
36:58,JIM: THIS RUN GOES FOR A FIRST DOWN.
36:59,DOWN. PHIL: YOU LOOK AT THE FIRST
37:01,"PHIL: YOU LOOK AT THE FIRST QUARTER, A COUPLE OF THINGS."
37:02,"QUARTER, A COUPLE OF THINGS. THE DENVER DEFENSE HAS STOPPED"
37:04,THE DENVER DEFENSE HAS STOPPED THE RUN GAME AND CAM NEWTON'S
37:06,THE RUN GAME AND CAM NEWTON'S OPTION LET HIM GET FREE AND THE
37:08,OPTION LET HIM GET FREE AND THE CAROLINA PANTHERS DID NOT TAKE
37:10,CAROLINA PANTHERS DID NOT TAKE ADVANTAGE OF SOME THROWING
37:11,ADVANTAGE OF SOME THROWING OPPORTUNITIES DOWN THE FIELD.
37:13,OPPORTUNITIES DOWN THE FIELD. JIM: MOVEMENT ON THE RIGHT SIDE
37:14,JIM: MOVEMENT ON THE RIGHT SIDE WITH OLSON AND DICKSON.
37:19,"WITH OLSON AND DICKSON. REFEREE: FALSE START, OFFENSE,"
37:21,"REFEREE: FALSE START, OFFENSE, NUMBER 84."
37:23,"NUMBER 84. FIVE-YARD PENALTY, STILL FIRST"
37:25,"FIVE-YARD PENALTY, STILL FIRST DOWN."
37:26,DOWN. JIM: DEMARCUS WARE IS WEARING A
37:29,JIM: DEMARCUS WARE IS WEARING A MIKE.
37:30,MIKE. LET'S LISTEN IN.
37:31,LET'S LISTEN IN.  HE WENT THROUGH THERE.
37:34, HE WENT THROUGH THERE. I'M GOING TO GO TO THE OTHER
37:36,I'M GOING TO GO TO THE OTHER SIDE AND I'M GOING TO GET HIM.
37:45,SIDE AND I'M GOING TO GET HIM. THAT'S WHAT I'M TALKING ABOUT.
37:48,THAT'S WHAT I'M TALKING ABOUT. JIM: HERE'S A FIRST AND 15.
37:52,JIM: HERE'S A FIRST AND 15. TIME FOR NEWTON THIS TIME.
37:54,TIME FOR NEWTON THIS TIME. ROLLING OUT.
37:56,ROLLING OUT. HE'S GOT ANOTHER GOOD GAIN.
37:59,HE'S GOT ANOTHER GOOD GAIN. PICKED UP BY VON MILLER AND
38:02,PICKED UP BY VON MILLER AND DRIVEN TO THE GROUND.
38:07,DRIVEN TO THE GROUND. SOME OF THE PANTHERS ON THE
38:09,SOME OF THE PANTHERS ON THE SIDELINE DIDN'T LIKE IT.
38:11,SIDELINE DIDN'T LIKE IT. PHIL: I LOVE THE FACT THAT CAM
38:14,PHIL: I LOVE THE FACT THAT CAM NEWTON GET OUTS OF THERE.
38:15,"NEWTON GET OUTS OF THERE. THE COVERAGE, WE'VE TALKED ABOUT"
38:17,"THE COVERAGE, WE'VE TALKED ABOUT IT, GREG OLSEN SLIPS AND FALLS"
38:21,"IT, GREG OLSEN SLIPS AND FALLS AND CAM NEWTON ONCE AGAIN GETS"
38:25,AND CAM NEWTON ONCE AGAIN GETS OUTSIDE AT THE SAME TIME.
38:29,OUTSIDE AT THE SAME TIME. -- CONTAINMENT.
38:32,-- CONTAINMENT. THE DENVER BRONCOS LOVE THE FACT
38:35,THE DENVER BRONCOS LOVE THE FACT THAT THEY THINK THEY CAN COVER
38:37,THAT THEY THINK THEY CAN COVER THESE WIDE RECEIVERS DOWN THE
38:38,THESE WIDE RECEIVERS DOWN THE FIELD.
38:39,FIELD. JIM: THAT WENT FOR 12.
38:40,JIM: THAT WENT FOR 12. IT'S A SECOND AND 3 AND STEWART
38:42,IT'S A SECOND AND 3 AND STEWART IS STOPPED ONE YARD SHORT OF THE
38:46,IS STOPPED ONE YARD SHORT OF THE FIRST BY TREVATHAN.
38:49,FIRST BY TREVATHAN. AND LET'S LOOK AT THE NEXT GEN
38:53,AND LET'S LOOK AT THE NEXT GEN STATS PRESENTED BY
38:54,STATS PRESENTED BY MERCEDES-BENZ.
38:58,MERCEDES-BENZ. PHIL: WOW.
38:59,PHIL: WOW. YOU SEE HOW FAST CAM NEWTON IS.
39:04,YOU SEE HOW FAST CAM NEWTON IS. THEY GOT HIM FASTER THAN ALL
39:06,THEY GOT HIM FASTER THAN ALL THOSE LINEBACKERS.
39:07,THOSE LINEBACKERS. I DON'T KNOW IF THEY ARE.
39:09,"I DON'T KNOW IF THEY ARE. THAT TELLS YOU, THE SIZE AND"
39:11,"THAT TELLS YOU, THE SIZE AND SPEED AT QUARTERBACK ONE OF THE"
39:12,SPEED AT QUARTERBACK ONE OF THE BIG CONCERNS FOR DENVER.
39:13,BIG CONCERNS FOR DENVER. THEY HAVE A LOT OF DIFFERENT
39:15,THEY HAVE A LOT OF DIFFERENT DEFENSES READY FOR IT.
39:17,DEFENSES READY FOR IT. SO FAR I HAVEN'T SEEN SOME OF
39:19,SO FAR I HAVEN'T SEEN SOME OF THOSE I SAW IN PRACTICE YET.
39:21,THOSE I SAW IN PRACTICE YET. JIM: THIRD AND 1.
39:22,JIM: THIRD AND 1. AN UNBALANCED LINE FOR CAROLINA
39:24,AN UNBALANCED LINE FOR CAROLINA AND HE'S GOING TO SWING IT BACK
39:26,AND HE'S GOING TO SWING IT BACK THE OTHER SIDE AND HE'S GOT GREG
39:28,THE OTHER SIDE AND HE'S GOT GREG OLSEN.
39:32,OLSEN. THE PANTHERS' OFFENSE PUTTING
39:39,THE PANTHERS' OFFENSE PUTTING SOMETHING TOGETHER FOR THE FIRST
39:40,SOMETHING TOGETHER FOR THE FIRST TIME.
39:41,TIME. PHIL: UNBALANCED LINE BY SHULA.
39:46,PHIL: UNBALANCED LINE BY SHULA. THE OFFENSE IS CHASING CAM
39:48,THE OFFENSE IS CHASING CAM NEWTON GOING TO THE RIGHT.
39:50,NEWTON GOING TO THE RIGHT. OLSEN GOES ACROSS THE FIELD.
39:52,OLSEN GOES ACROSS THE FIELD. LOOK HOW LONG HE SOLD IT AND
39:54,LOOK HOW LONG HE SOLD IT AND BLOCKED.
39:55,BLOCKED. THAT'S WHAT FINALLY ALLOWED HIM
39:58,THAT'S WHAT FINALLY ALLOWED HIM TO BE OPEN FOR THE THROW.
40:00,TO BE OPEN FOR THE THROW. JIM: THEIR FIRST TRIP OF THIS
40:02,JIM: THEIR FIRST TRIP OF THIS SUPER BOWL INTO THE RED ZONE AT
40:05,SUPER BOWL INTO THE RED ZONE AT THE 15.
40:07,THE 15. THAT LAST PLAY GAINED 19.
40:10,THAT LAST PLAY GAINED 19. A DRIVE THAT BEGAN BACK AT THE
40:12,A DRIVE THAT BEGAN BACK AT THE CAROLINA 27.
40:13,CAROLINA 27. CAM HAS PHILLY BROWN AND HE'S
40:16,CAM HAS PHILLY BROWN AND HE'S TWISTED OUT OF BOUNDS AND A
40:17,TWISTED OUT OF BOUNDS AND A FACEMASK CALL.
40:19,FACEMASK CALL. TALIB IS GOING TO BE FLAGGED FOR
40:21,TALIB IS GOING TO BE FLAGGED FOR THE SECOND TIME IN THIS HALF.
40:31,THE SECOND TIME IN THIS HALF. PHIL: THERE'S NO DOUBT HE
40:32,PHIL: THERE'S NO DOUBT HE GRABBED THE FACEMASK TO TACKLE
40:35,GRABBED THE FACEMASK TO TACKLE CORY BROWN.
40:37,"CORY BROWN. REFEREE: PERSONAL FOUL, GRABBING"
40:39,"REFEREE: PERSONAL FOUL, GRABBING THE FACEMASK, DEFENSE, NUMBER"
40:41,"THE FACEMASK, DEFENSE, NUMBER 21."
40:43,21. HALF THE DISTANCE TO THE GOAL
40:45,HALF THE DISTANCE TO THE GOAL LINE.
40:46,"LINE. PHIL: FROM RIGHT TO LEFT, COREY"
40:48,"PHIL: FROM RIGHT TO LEFT, COREY BROWN GETS A STEP ON AQIB TALIB."
40:54,BROWN GETS A STEP ON AQIB TALIB. TALIB JUST MAKING SURE HE GETS
40:56,TALIB JUST MAKING SURE HE GETS THE TACKLE.
40:57,THE TACKLE. REALLY DANGEROUS PLAY.
40:59,"REALLY DANGEROUS PLAY. JIM: THEY MARK THE FOOTBALL, AS"
41:01,"JIM: THEY MARK THE FOOTBALL, AS WE LOOK AT OUR PYLON CAM, INSIDE"
41:03,"WE LOOK AT OUR PYLON CAM, INSIDE OF THE 1."
41:10,OF THE 1. BOTH STEWART AND TOLBERT IN THE
41:14,BOTH STEWART AND TOLBERT IN THE BACKFIELD.
41:15,BACKFIELD. FIRST AND GOAL.
41:16,FIRST AND GOAL. STEWART.
41:17,STEWART. AND IN WITH A CAROLINA
41:19,AND IN WITH A CAROLINA TOUCHDOWN!
41:31,TOUCHDOWN! PHIL: THAT WILL GIVE CONFIDENCE
41:32,PHIL: THAT WILL GIVE CONFIDENCE THAT DRIVE TO THIS CAROLINA
41:34,THAT DRIVE TO THIS CAROLINA OFFENSE.
41:35,OFFENSE. A COUPLE OF CAM NEWTON RUNS.
41:38,A COUPLE OF CAM NEWTON RUNS. A TREMENDOUS PLAY CALL BY MIKE
41:41,A TREMENDOUS PLAY CALL BY MIKE SHULA WITH THE UNBALANCED LINE
41:43,SHULA WITH THE UNBALANCED LINE AND SENDING OLSEN ACROSS THE
41:46,AND SENDING OLSEN ACROSS THE FORMATION FOR A BIG GAIN.
41:48,FORMATION FOR A BIG GAIN. HOW ABOUT THAT JUMP?
41:50,"HOW ABOUT THAT JUMP? JIM: YEAH, HIS FOOT MUST BE OK."
41:53,"JIM: YEAH, HIS FOOT MUST BE OK. PHIL: YOU DON'T SEE THAT JUMP"
41:54,PHIL: YOU DON'T SEE THAT JUMP PLAY TOO MUCH IN THE NFL ANYMORE
41:57,PLAY TOO MUCH IN THE NFL ANYMORE BECAUSE DEFENSIVE LINEMEN MAKE
42:00,BECAUSE DEFENSIVE LINEMEN MAKE SO MUCH PENETRATION.
42:01,SO MUCH PENETRATION. LOOKED LIKE MARCUS ALLEN.
42:03,"LOOKED LIKE MARCUS ALLEN. JIM: I WAS GOING TO SAY, IN THAT"
42:06,"JIM: I WAS GOING TO SAY, IN THAT PARADE OF M.V.P.'S YOU JUST SAW."
42:11,PARADE OF M.V.P.'S YOU JUST SAW. GANO'S EXTRA POINT IS GOOD BUT
42:13,GANO'S EXTRA POINT IS GOOD BUT THERE IS A FLAG ON THE P.A.T.
42:18,THERE IS A FLAG ON THE P.A.T. MIGHT HAVE BEEN TALIB AGAIN.
42:20,MIGHT HAVE BEEN TALIB AGAIN. HE MIGHT HAVE BEEN OFFSIDES
42:22,HE MIGHT HAVE BEEN OFFSIDES HERE.
42:33,HERE. NUDGES IT'S A 73-YARD TOUCHDOWN
42:36,NUDGES IT'S A 73-YARD TOUCHDOWN DRIVE BY CAROLINA.
42:38,"DRIVE BY CAROLINA. -- NONETHELESS, IT'S A 73-YARD"
42:41,"-- NONETHELESS, IT'S A 73-YARD TOUCHDOWN DRIVE BY CAROLINA."
42:43,"TOUCHDOWN DRIVE BY CAROLINA. REFEREE: OFFSIDES, DEFENSE,"
42:44,"REFEREE: OFFSIDES, DEFENSE, NUMBER 21."
42:47,NUMBER 21. THE FIVE-YARD PENALTY WILL BE
42:50,THE FIVE-YARD PENALTY WILL BE ASSESSED ON THE KICKOFF.
42:51,ASSESSED ON THE KICKOFF. P.A.T. IS GOOD.
42:53,P.A.T. IS GOOD. JIM: A ROUGH START HERE FOR
42:57,"JIM: A ROUGH START HERE FOR TALIB, FLAGGED THREE TIMES."
42:59,"TALIB, FLAGGED THREE TIMES. JONATHAN STEWART HAS A SUPER"
43:00,JONATHAN STEWART HAS A SUPER BOWL TOUCHDOWN AND HE'S GOT
43:02,BOWL TOUCHDOWN AND HE'S GOT CAROLINA ON THE BOARD.
43:10,JIM: THE PANTHERS TAKE IT DOWN
43:12,JIM: THE PANTHERS TAKE IT DOWN THE FIELD.
43:14,THE FIELD. THINGS CERTAINLY OPENED UP WITH
43:16,THINGS CERTAINLY OPENED UP WITH CAM RUNNING THE FOOTBALL A
43:17,CAM RUNNING THE FOOTBALL A COUPLE OF TIMES.
43:18,COUPLE OF TIMES. TWO RUSHES FOR 23 YARDS.
43:20,TWO RUSHES FOR 23 YARDS. HE WAS 4-4 PASSING ON THAT
43:22,HE WAS 4-4 PASSING ON THAT TOUCHDOWN DRIVE THAT ENDED WITH
43:25,TOUCHDOWN DRIVE THAT ENDED WITH THE JONATHAN STEWART DIVE OVER
43:26,THE JONATHAN STEWART DIVE OVER THE TOP.
43:27,THE TOP. FROM A YARD OUT.
43:30,FROM A YARD OUT. AND THEY'RE KICKING FROM THE 40
43:33,AND THEY'RE KICKING FROM THE 40 BECAUSE OF THE TALIB PENALTY.
43:38,BECAUSE OF THE TALIB PENALTY. AND THAT BOUNCES THROUGH THE
43:39,AND THAT BOUNCES THROUGH THE BACK OF THE END ZONE.
43:46,BACK OF THE END ZONE. SOME SERIOUS HANG TIME HERE FOR
43:48,SOME SERIOUS HANG TIME HERE FOR JONATHAN STEWART.
43:49,JONATHAN STEWART. PHIL: IT REALLY IS.
43:50,PHIL: IT REALLY IS. GOOD BLOCK UP FRONT JUST ALLOWS
43:52,GOOD BLOCK UP FRONT JUST ALLOWS HIM THE CHANCE TO GET HIS FEET
43:55,HIM THE CHANCE TO GET HIS FEET UNDER HIS SHOULDERS AND JUMP SO
43:57,UNDER HIS SHOULDERS AND JUMP SO HIGH TO GET THAT TOUCHDOWN.
43:59,HIGH TO GET THAT TOUCHDOWN. GREAT JOB BY STEWART.
44:04,"GREAT JOB BY STEWART. CAROLINA, YOU STOP THEIR RUN"
44:06,"CAROLINA, YOU STOP THEIR RUN GAME, YOU STILL HAVE TO STOP THE"
44:09,"GAME, YOU STILL HAVE TO STOP THE PASSING OF CAM NEWTON, AND HIM"
44:12,"PASSING OF CAM NEWTON, AND HIM RUNNING FROM DROPBACK"
44:13,RUNNING FROM DROPBACK SITUATIONS.
44:20,SITUATIONS. JIM: MANNING SWITCHES THINGS UP
44:21,JIM: MANNING SWITCHES THINGS UP AT THE LINE OF SCRIMMAGE.
44:23,AT THE LINE OF SCRIMMAGE. AND HE'S TRIPPED UP.
44:24,AND HE'S TRIPPED UP. HE'S DOWN.
44:25,HE'S DOWN. WAS HE TOUCHED DOWN?
44:27,WAS HE TOUCHED DOWN? NOW THE BALL SQUIRTS OUT OF HIDS
44:30,NOW THE BALL SQUIRTS OUT OF HIDS HIS HANDS AND IS PICKED UP BY
44:34,HIS HANDS AND IS PICKED UP BY VIRGIL GREEN.
44:36,"VIRGIL GREEN. PHIL: IT WILL BE INCOMPLETE,"
44:38,"PHIL: IT WILL BE INCOMPLETE, THROWING IT UNDERHANDED."
44:40,"THROWING IT UNDERHANDED. JIM: THERE WAS THAT ONE POINT,"
44:42,"JIM: THERE WAS THAT ONE POINT, TOO, WHERE HE SLIPPED AND DID E"
44:49,"TOO, WHERE HE SLIPPED AND DID E LY TOUCH HIM AND YES, HE DID."
44:52,"LY TOUCH HIM AND YES, HE DID. RON RIVERA WOULD HAVE TO"
44:53,RON RIVERA WOULD HAVE TO CHALLENGE THAT.
44:56,CHALLENGE THAT. JIM: IT GOES AS AN INCOMPLETION
44:58,JIM: IT GOES AS AN INCOMPLETION AND THE CHALLENGE FLAG IS OUT.
45:00,AND THE CHALLENGE FLAG IS OUT. PHIL: HE'S STILL STEAMING ABOUT
45:02,PHIL: HE'S STILL STEAMING ABOUT THE FIRST CHALLENGE THAT HE
45:03,THE FIRST CHALLENGE THAT HE THREW OUT THERE AND GOT THE
45:05,THREW OUT THERE AND GOT THE INCOMPLETION TO JERRICHO
45:06,INCOMPLETION TO JERRICHO COTCHERY.
45:07,COTCHERY. DON'T YOU THINK?
45:08,DON'T YOU THINK? JIM:
45:09,JIM: OH.
45:10,"OH. WELL, YOU THINK ABOUT WHAT THAT"
45:12,"WELL, YOU THINK ABOUT WHAT THAT SET UP IN THE END."
45:13,SET UP IN THE END. AND LATER IN THAT SERIES AFTER
45:15,AND LATER IN THAT SERIES AFTER THEY DIDN'T WIN THE CHALLENGE.
45:17,"THEY DIDN'T WIN THE CHALLENGE. THAT LED, OF COURSE, TO THE"
45:19,"THAT LED, OF COURSE, TO THE STRIP SACK AND FUMBLE RECOVERY"
45:21,STRIP SACK AND FUMBLE RECOVERY TOUCHDOWN FOR DENVER.
45:27,TOUCHDOWN FOR DENVER. AND WHAT APPEARED TO US TO HAVE
45:29,AND WHAT APPEARED TO US TO HAVE BEEN A CATCH.
45:33,BEEN A CATCH. SO RIVERA IS GOING TO CHALLENGE
45:35,SO RIVERA IS GOING TO CHALLENGE THIS.
45:36,THIS. REFEREE: CAROLINA IS CHALLENGING
45:38,REFEREE: CAROLINA IS CHALLENGING THE RULING ON THE FIELD THAT THE
45:43,THE RULING ON THE FIELD THAT THE QUARTERBACK WAS NOT DOWN BY
45:45,QUARTERBACK WAS NOT DOWN BY CONTACT PRIOR TO THE FORWARD
45:47,CONTACT PRIOR TO THE FORWARD PASS.
45:48,PASS. JIM: DEVPBLET CONTACT
45:56,JIM: DEVPBLET CONTACT JIM: SUPER BOWL 50 ON CBS IS
45:58,JIM: SUPER BOWL 50 ON CBS IS SPONSORED BY --
46:15,JIM: THE BEAUTIFUL VIEWS ALONG
46:17,JIM: THE BEAUTIFUL VIEWS ALONG THE COAST OF NORTHERN CALIFORNIA
46:19,THE COAST OF NORTHERN CALIFORNIA ALL THE WAY SOUTH OF HERE TO
46:21,ALL THE WAY SOUTH OF HERE TO PEBBLE BEACH AND THE BIG SUR AND
46:24,PEBBLE BEACH AND THE BIG SUR AND BEYOND.
46:25,BEYOND. REFEREE: AFTER REVIEW OF THE
46:26,"REFEREE: AFTER REVIEW OF THE PLAY, THE QUARTERBACK WAS"
46:28,"PLAY, THE QUARTERBACK WAS TOUCHED AND WENT DOWN BY CONTACT"
46:30,TOUCHED AND WENT DOWN BY CONTACT AT THE 13-YARD LINE.
46:32,AT THE 13-YARD LINE. IT WILL BE SECOND DOWN FROM THAT
46:34,IT WILL BE SECOND DOWN FROM THAT POINT.
46:35,POINT. CAROLINA WILL NOT BE CHARGED A
46:36,CAROLINA WILL NOT BE CHARGED A TIME-OUT.
46:37,"TIME-OUT. HOWEVER, THEY ARE OUT OF"
46:38,"HOWEVER, THEY ARE OUT OF CHALLENGES."
46:39,CHALLENGES. JIM: THAT'S THE BIG QUESTION.
46:41,JIM: THAT'S THE BIG QUESTION. YOU'RE FOUR MINUTES INTO THE
46:42,YOU'RE FOUR MINUTES INTO THE SECOND QUARTER AND YOU CANNOT
46:44,SECOND QUARTER AND YOU CANNOT CHALLENGE ANYTHING THE REST OF
46:45,CHALLENGE ANYTHING THE REST OF THE WAY.
46:46,THE WAY. WAS IT WORTH THE SERVE YARDS?
46:50,"WAS IT WORTH THE SERVE YARDS? PHIL: ME, YES."
46:52,"PHIL: ME, YES. TAKE IT RIGHT NOW, YOU PUT THIS"
46:55,"TAKE IT RIGHT NOW, YOU PUT THIS OFFENSE IN A REALLY TOUGH"
46:57,OFFENSE IN A REALLY TOUGH SITUATION.
46:58,SITUATION. IT'S OBVIOUS PASS.
46:59,IT'S OBVIOUS PASS. YOU'RE STARTING TO DOMINATE A
47:02,YOU'RE STARTING TO DOMINATE A LITTLE BIT ON THE OFFENSIVE
47:03,"LITTLE BIT ON THE OFFENSIVE SIDE, I THINK, UP FRONT."
47:05,"SIDE, I THINK, UP FRONT. PEYTON MANNING DOMINATED BY PASS"
47:07,PEYTON MANNING DOMINATED BY PASS RUSHERS.
47:08,RUSHERS. THEY DIDN'T PICK UP THE BLITZ.
47:10,THEY DIDN'T PICK UP THE BLITZ. RON RIVERA DOES EVERYTHING BY
47:12,RON RIVERA DOES EVERYTHING BY HIS INSTINCTS.
47:14,HIS INSTINCTS. JIM: SECOND AND 17.
47:16,JIM: SECOND AND 17. DEMARYIUS THOMAS IS ON THE NEAR
47:18,DEMARYIUS THOMAS IS ON THE NEAR SIDE.
47:19,SIDE. NORMAN IS ON HIM.
47:20,NORMAN IS ON HIM. THOMAS HASN'T BEEN TARGETED SO
47:22,THOMAS HASN'T BEEN TARGETED SO FAR.
47:23,FAR. AND ALMOST INTERCEPTED BY
47:25,AND ALMOST INTERCEPTED BY NORMAN!
47:26,NORMAN! WHO CAME OVER TO HELP OUT ON THE
47:29,WHO CAME OVER TO HELP OUT ON THE COVERAGE OF NORWOOD.
47:32,COVERAGE OF NORWOOD. PHIL: REALLY A TERRIFIC PLAY BY
47:34,PHIL: REALLY A TERRIFIC PLAY BY JOSH NORMAN.
47:35,JOSH NORMAN. HERE GOES THE SLOT RECEIVER.
47:39,HERE GOES THE SLOT RECEIVER. AT THE LAST SECOND YOU THINK
47:40,AT THE LAST SECOND YOU THINK MANNING HAS A BIG COMPLETION BUT
47:43,"MANNING HAS A BIG COMPLETION BUT JOSH NORMAN FAST ENOUGH, AND OF"
47:45,"JOSH NORMAN FAST ENOUGH, AND OF COURSE LONG ARMS HELPED HIM DO"
47:48,COURSE LONG ARMS HELPED HIM DO HIS RESPONSIBILITY PERFECT.
47:55,HIS RESPONSIBILITY PERFECT. JIM: THIRD AND 17.
48:05,"JIM: THIRD AND 17. UNDERNEATH, BALL IN THE AIR,"
48:07,"UNDERNEATH, BALL IN THE AIR, INCOMPLETE."
48:10,"INCOMPLETE. GREAT HIT, KUECHLY ON DEMARYIUS"
48:13,"GREAT HIT, KUECHLY ON DEMARYIUS THOMAS."
48:14,"THOMAS. PHIL: AGAIN, KUECHLY, THOMAS"
48:17,"PHIL: AGAIN, KUECHLY, THOMAS DAVIS, HOW ABOUT SOME OF THE"
48:18,"DAVIS, HOW ABOUT SOME OF THE HITS AND PLAYS THEY MAKE?"
48:20,HITS AND PLAYS THEY MAKE? THEY READ THE QUARTERBACK SO
48:22,THEY READ THE QUARTERBACK SO FAST AND SO WELL THAT YOU SEE
48:24,FAST AND SO WELL THAT YOU SEE PLAYS LIKE THIS.
48:25,PLAYS LIKE THIS. YOU THINK WHERE DO THEY GET ALL
48:26,YOU THINK WHERE DO THEY GET ALL THE TURNOVERS?
48:28,THE TURNOVERS? BECAUSE OF PLAYS LIKE THAT.
48:31,BECAUSE OF PLAYS LIKE THAT. JIM: THIRD STRAIGHT THREE AND
48:33,JIM: THIRD STRAIGHT THREE AND OUT FOR THE BRONCOS AND NOW
48:34,OUT FOR THE BRONCOS AND NOW COLQUITT TO PUNT.
48:37,COLQUITT TO PUNT. 227 PUNTS IN SUPER BOWL HISTORY
48:40,227 PUNTS IN SUPER BOWL HISTORY AND THERE'S NEVER BEEN ONE
48:41,AND THERE'S NEVER BEEN ONE RETURNED FOR A TOUCHDOWN.
48:43,"RETURNED FOR A TOUCHDOWN. AND THIS ONE WON'T EITHER, AS"
48:45,"AND THIS ONE WON'T EITHER, AS GINN CATCHES IT ON THE SIDELINE."
48:48,GINN CATCHES IT ON THE SIDELINE. A FLAG IS ON THE FIELD BACK AT
48:49,A FLAG IS ON THE FIELD BACK AT THE 15.
48:59,THE 15. COLQUITT WITH A BOOMING
49:02,COLQUITT WITH A BOOMING 52-YARDER.
49:05,52-YARDER. NEVER GAVE GINN A CHANCE DO
49:07,NEVER GAVE GINN A CHANCE DO ANYTHING WITH IT AS HE ANGLED IT
49:09,ANYTHING WITH IT AS HE ANGLED IT TO THE SIDELINE AND DEEP.
49:14,TO THE SIDELINE AND DEEP. REFEREE: INELIGIBLE MAN
49:15,"REFEREE: INELIGIBLE MAN DOWNFIELD, THE KICKING TEAM"
49:18,"DOWNFIELD, THE KICKING TEAM NUMBER 351."
49:19,NUMBER 351. A FIVE-YARD PENALTY AT THE END
49:21,"A FIVE-YARD PENALTY AT THE END OF THE KICK, FIRST DOWN."
49:24,"OF THE KICK, FIRST DOWN. JIM: EARLIER TONIGHT, NFL PLAY"
49:29,"JIM: EARLIER TONIGHT, NFL PLAY 60 SUPER KILLED MARLO MOSLEY"
49:32,60 SUPER KILLED MARLO MOSLEY MADE THE ULTIMATE HANDOFF WHEN
49:35,MADE THE ULTIMATE HANDOFF WHEN SHE DELIVERED THE BALL TO THE
49:37,SHE DELIVERED THE BALL TO THE OFFICIALS TO BEGIN SUPER BOWL
49:38,OFFICIALS TO BEGIN SUPER BOWL 50.
49:39,"50. TO LEARN MORE ABOUT NFL PLAY 60,"
49:43,"TO LEARN MORE ABOUT NFL PLAY 60, VISIT NFLRUSH.COM."
49:46,"VISIT NFLRUSH.COM. I DON'T KNOW WHY, IF YOU HAD THE"
49:48,"I DON'T KNOW WHY, IF YOU HAD THE OPTION, WOULDN'T REKICK IT"
49:51,"OPTION, WOULDN'T REKICK IT INSTEAD OF TAKING THE FIVE ON"
49:52,INSTEAD OF TAKING THE FIVE ON THE OTHER END AND I THINK IT'S
49:54,THE OTHER END AND I THINK IT'S GOING TO BE GIVEN A SECOND
49:56,GOING TO BE GIVEN A SECOND THOUGHT.
49:57,"THOUGHT. YEAH, THEY'RE RETREATING BACK TO"
49:59,"YEAH, THEY'RE RETREATING BACK TO THE DENVER SIDE OF THE FIELD."
50:01,THE DENVER SIDE OF THE FIELD. DEMARYIUS THOMAS IS SHAKEN UP
50:03,DEMARYIUS THOMAS IS SHAKEN UP AND COLQUITT WILL HAVE TO PUNT
50:05,AND COLQUITT WILL HAVE TO PUNT AGAIN NEAR HIS OWN END ZONE.
50:07,"AGAIN NEAR HIS OWN END ZONE. PHIL: THAT'S A BIG DEAL,"
50:10,"PHIL: THAT'S A BIG DEAL, DEMARYIUS THOMAS BEING IN THAT"
50:12,"DEMARYIUS THOMAS BEING IN THAT SITUATION, BECAUSE I THINK ONE"
50:14,"SITUATION, BECAUSE I THINK ONE OF THE GOOD MATCHUPS IN THIS"
50:17,"OF THE GOOD MATCHUPS IN THIS GAME, EMMANUEL SAND,-DEMARYIUS"
50:21,"GAME, EMMANUEL SAND,-DEMARYIUS THOMAS AGAINST THE DEFENSIVE"
50:25,THOMAS AGAINST THE DEFENSIVE BACK OF THE CAROLINA PANTHERS.
50:30,BACK OF THE CAROLINA PANTHERS. JIM: AARON BREWER IS THE LONG
50:33,JIM: AARON BREWER IS THE LONG SNAPPER.
50:34,SNAPPER. SENDS IT BACK.
50:35,SENDS IT BACK. AND COLQUITT DIDN'T CATCH THIS
50:38,AND COLQUITT DIDN'T CATCH THIS ONE.
50:39,ONE. IT HITS RIGHT AT THE 50.
50:44,IT HITS RIGHT AT THE 50. LET'S GET A REPORT ON THE
50:46,LET'S GET A REPORT ON THE SIDELINE FROM EVAN.
50:48,"SIDELINE FROM EVAN. EVAN: JIM, THE PANTHERS ARE"
50:51,"EVAN: JIM, THE PANTHERS ARE MANAGING THEIR FOOT WEAR AND"
50:53,MANAGING THEIR FOOT WEAR AND FOOTING IN THIS SECOND QUARTER.
50:55,FOOTING IN THIS SECOND QUARTER. AT LEAST FOUR PLAYERS HAVE
50:56,AT LEAST FOUR PLAYERS HAVE CHANGED TO A DIFFERENT PAIR OF
50:58,CHANGED TO A DIFFERENT PAIR OF CLEATS.
50:59,"CLEATS. MOST KNOWS BLI AND RECENTLY,"
51:00,"MOST KNOWS BLI AND RECENTLY, GREG OLSEN."
51:01,GREG OLSEN. ALSO SEEING THE ATHLETIC
51:04,ALSO SEEING THE ATHLETIC TRAINERS PUTTING NEW STUDS ON
51:05,TRAINERS PUTTING NEW STUDS ON SOME OF THOSE CLEATS TO MANAGE
51:07,SOME OF THOSE CLEATS TO MANAGE THE FOOTING ON THIS FIELD.
51:10,THE FOOTING ON THIS FIELD. JIM?
51:11,"JIM? JIM: THAT PENALTY -- THANK YOU,"
51:13,"JIM: THAT PENALTY -- THANK YOU, EVAN."
51:14,EVAN. THAT COST DENVER 14 YARDS AND
51:16,THAT COST DENVER 14 YARDS AND GIVES THE PANTHERS FIELD
51:19,GIVES THE PANTHERS FIELD POSITION AT THEIR OWN 49.
51:29,POSITION AT THEIR OWN 49. THAT'S STEWART.
51:30,THAT'S STEWART. FOR TWO.
51:33,FOR TWO. MALIK JACKSON HAS HIM WRAPPED
