time,transcript
118:25,A THIRD AND 10. GOT TIME.
118:26,GOT TIME. AND IT'S INCOMPLETE.
118:28,AND IT'S INCOMPLETE. AND AGAIN IS LOOKING AROUND AND
118:32,"AND AGAIN IS LOOKING AROUND AND SAYING WHAT -- WAIT A MINUTE,"
118:33,"SAYING WHAT -- WAIT A MINUTE, WHERE WAS THE FLAG?"
118:35,WHERE WAS THE FLAG? ROBY BROKE IT UP.
118:36,ROBY BROKE IT UP. PHIL: WE STARTED THE DAY TALKING
118:38,PHIL: WE STARTED THE DAY TALKING ABOUT THE TRIO OF DEFENSIVE
118:41,ABOUT THE TRIO OF DEFENSIVE BACKS.
118:42,"BACKS. ROBY, TOP OF YOUR SCREEN, NUMBER"
118:43,"ROBY, TOP OF YOUR SCREEN, NUMBER 29."
118:44,"29. A LOT OF CONTACT, REALLY."
118:49,"A LOT OF CONTACT, REALLY. A FLAG COULD HAVE BEEN THROWN"
118:51,A FLAG COULD HAVE BEEN THROWN THERE AND IT WASN'T.
118:52,THERE AND IT WASN'T. BRADLEY ROBY GOT AWAY WITH ONE.
118:54,BRADLEY ROBY GOT AWAY WITH ONE. JIM: THIS IS A CRUCIAL FIELD
118:56,JIM: THIS IS A CRUCIAL FIELD GOAL FROM 39 YARDS TO BRING IT
118:58,GOAL FROM 39 YARDS TO BRING IT TO A ONE-SCORE GAME.
119:00,TO A ONE-SCORE GAME. GANO.
119:03,GANO. AND THE KICK IS GOOD.
119:14,AND THE KICK IS GOOD. THE FIELD GOAL SET UP BY THE
119:16,THE FIELD GOAL SET UP BY THE FUMBLE FORCED BY EALY.
119:20,FUMBLE FORCED BY EALY. GANO NAILS IT FROM 39 YARDS OUT.
119:30,GANO NAILS IT FROM 39 YARDS OUT. JIM: SUPER BOWL 50 ON CBS IS
119:31,JIM: SUPER BOWL 50 ON CBS IS SPONSORED BY --
119:49,JIM: THE GOLDEN GAME DOWN TO
119:54,JIM: THE GOLDEN GAME DOWN TO 10:21 TO GO AND IT'S 16-10
119:57,10:21 TO GO AND IT'S 16-10 BRONCOS.
120:02,BRONCOS. A LOT OF FIRE IN THAT SPEECH
120:05,A LOT OF FIRE IN THAT SPEECH FROM THOMAS DAVIS.
120:07,FROM THOMAS DAVIS. COMING UP TO FIELD IT IS
120:09,COMING UP TO FIELD IT IS CALDWELL.
120:10,CALDWELL. GETS PAST THE FIRST COUPLE OF
120:12,GETS PAST THE FIRST COUPLE OF PANTHERS AND IS RIDDEN DOWN BY
120:15,PANTHERS AND IS RIDDEN DOWN BY FOZZY WHITTAKER AT THE 24.
120:18,FOZZY WHITTAKER AT THE 24. ONE OFFENSIVE TOUCHDOWN IN THIS
120:20,ONE OFFENSIVE TOUCHDOWN IN THIS GAME.
120:21,GAME. ONE DEFENSIVE TOUCHDOWN.
120:23,ONE DEFENSIVE TOUCHDOWN. AND IT'S 16-10 BRONCOS.
120:29,AND IT'S 16-10 BRONCOS. JIM: LET'S TAKE A LOOK AT NEXT
120:33,JIM: LET'S TAKE A LOOK AT NEXT GEN STATS PRESENTED BY
120:35,GEN STATS PRESENTED BY MERCEDES-BENZ.
120:36,MERCEDES-BENZ. PHIL: YOU HAVE SPEED AT THE
120:37,PHIL: YOU HAVE SPEED AT THE LINEBACKER POSITION.
120:39,"LINEBACKER POSITION. THOMAS DAVIS GETS OUTSIDE,"
120:40,"THOMAS DAVIS GETS OUTSIDE, COVERS A LOT OF GROUND AND THEN"
120:42,COVERS A LOT OF GROUND AND THEN LUKE KUECHLY ON THE BLITZ.
120:44,LUKE KUECHLY ON THE BLITZ. SO QUICK NOTHING PEYTON MANNING
120:45,SO QUICK NOTHING PEYTON MANNING CAN DO.
120:46,"CAN DO. THE KEY TO THE DEFENSE, THE"
120:48,"THE KEY TO THE DEFENSE, THE LINEBACKERS ARE THE STARS"
120:52,"LINEBACKERS ARE THE STARS BECAUSE THEY HAVE GOOD, UP-FRONT"
120:54,"BECAUSE THEY HAVE GOOD, UP-FRONT PEOPLE THAT PROTECT THEM AND LET"
120:56,PEOPLE THAT PROTECT THEM AND LET THEM RUN FREE AND MAKE ALL THOSE
120:59,THEM RUN FREE AND MAKE ALL THOSE PLACE.
121:00,"PLACE. JIM: FIRST DOWN, QUICK THROW,"
121:01,"JIM: FIRST DOWN, QUICK THROW, ANDERSON."
121:03,"ANDERSON. HE'S TACKLED BY CHARLES JOHNSON,"
121:05,"HE'S TACKLED BY CHARLES JOHNSON, WHO WE GAVE CREDIT TO ON THE"
121:07,WHO WE GAVE CREDIT TO ON THE FUMBLE RECOVERY AND THEY CHANGED
121:09,"FUMBLE RECOVERY AND THEY CHANGED IT OFFICIALLY LATER, GIVING EALY"
121:11,"IT OFFICIALLY LATER, GIVING EALY THE RECOVERY AND THE STRIP."
121:14,"THE RECOVERY AND THE STRIP. PHIL: VERY TYPICAL PLAY, BLITZ"
121:16,"PHIL: VERY TYPICAL PLAY, BLITZ BY THE LINEBACKER, CHARLES"
121:19,"BY THE LINEBACKER, CHARLES JOHNSON DROPS OFF IN COVERAGE."
121:20,JOHNSON DROPS OFF IN COVERAGE. GOOD JOB BY HIM.
121:22,GOOD JOB BY HIM. JIM: IT PICKED UP TWO.
121:25,JIM: IT PICKED UP TWO. MAKE IT SECOND AND 8.
121:37,MAKE IT SECOND AND 8. BACK TO ANDERSON.
121:39,BACK TO ANDERSON. HE WAS TRYING TO GET A RUNNING
121:42,HE WAS TRYING TO GET A RUNNING START BUT GOT KNOCKED DOWN BY
121:44,START BUT GOT KNOCKED DOWN BY LOTULELEI AFTER ANOTHER TWO-YARD
121:45,LOTULELEI AFTER ANOTHER TWO-YARD PICKUP.
121:48,PICKUP. PHIL: DENVER'S BEEN IN THIS
121:51,PHIL: DENVER'S BEEN IN THIS SITUATION SO MANY TIMES WHERE
121:53,SITUATION SO MANY TIMES WHERE THEIR DEFENSE HAS BEEN
121:54,THEIR DEFENSE HAS BEEN OUTSTANDING AND THE OFFENSE IS
121:56,OUTSTANDING AND THE OFFENSE IS JUST TRYING TO FIND A WAY TO GET
121:58,JUST TRYING TO FIND A WAY TO GET THIS CLOCK TO KEEP IT MOVING TO
122:01,THIS CLOCK TO KEEP IT MOVING TO PICK UP A FIRST DOWN OR TWO AND
122:03,PICK UP A FIRST DOWN OR TWO AND CHANGE FIELD POSITION.
122:04,CHANGE FIELD POSITION. JIM: MISSED ON THEIR LAST 10
122:06,JIM: MISSED ON THEIR LAST 10 THIRD DOWN ATTEMPTS AND IT'S
122:08,THIRD DOWN ATTEMPTS AND IT'S KNOCKED AWAY BY NORMAN.
122:10,KNOCKED AWAY BY NORMAN. THE PASS WAS THROWN IN THE
122:12,THE PASS WAS THROWN IN THE DIRECTION OF DEMARYIUS THOMAS
122:14,DIRECTION OF DEMARYIUS THOMAS WHO JUST DOES NOT LOOK LIKE THE
122:15,WHO JUST DOES NOT LOOK LIKE THE SAME PLAYER.
122:17,SAME PLAYER. PHIL: HE DOESN'T BUT I WOULDN'T
122:19,PHIL: HE DOESN'T BUT I WOULDN'T THROW AT JOSH NORMAN.
122:21,THROW AT JOSH NORMAN. JOSH NORMAN ALL NIGHT HAS BEEN
122:23,JOSH NORMAN ALL NIGHT HAS BEEN NEAR THE FOOTBALL TRYING TO MAKE
122:25,NEAR THE FOOTBALL TRYING TO MAKE THOSE PLAYS.
122:26,THOSE PLAYS. JIM: BUT IT'S BEEN A ROUGH
122:28,"JIM: BUT IT'S BEEN A ROUGH POSTSEASON FOR THOMAS, COMING"
122:31,"POSTSEASON FOR THOMAS, COMING AFTER A 1,300-YARD SEASON."
122:35,"AFTER A 1,300-YARD SEASON. FIFTH TIME TONIGHT, THREE PLAYS"
122:37,"FIFTH TIME TONIGHT, THREE PLAYS AND A PUNT."
122:40,AND A PUNT. AND GINN TAKES IT OUT OF BOUNDS
122:44,AND GINN TAKES IT OUT OF BOUNDS AT ABOUT THE 27.
122:50,AT ABOUT THE 27. SO IT'S A GAME THAT'S FEATURED
122:55,"SO IT'S A GAME THAT'S FEATURED 14 PEDGETS, FIVE SACKS, FIVE"
122:59,"14 PEDGETS, FIVE SACKS, FIVE TURNOVERS AND SO FAR ONLY ONE"
123:03,TURNOVERS AND SO FAR ONLY ONE OFFENSIVE TOUCHDOWN AND THAT WAS
123:04,OFFENSIVE TOUCHDOWN AND THAT WAS A THRILLING ONE-YARD RUN.
123:06,A THRILLING ONE-YARD RUN. FAVRE THE DEFENSES TOOK THEIR
123:07,FAVRE THE DEFENSES TOOK THEIR TWO WEEKS AND REALLY TOOK
123:09,TWO WEEKS AND REALLY TOOK ADVANTAGE OF IT.
123:10,"ADVANTAGE OF IT. WHEN YOU TALK ABOUT IT, THE"
123:13,"WHEN YOU TALK ABOUT IT, THE DENVER DEFENSE DID BECAUSE THEY"
123:14,DENVER DEFENSE DID BECAUSE THEY HAD TO GET READY FOR SOMETHING
123:17,HAD TO GET READY FOR SOMETHING THEY HADN'T SEEN BEFORE.
123:18,THEY HADN'T SEEN BEFORE. WHEN IN A LEAGUE WHERE EVERYBODY
123:20,WHEN IN A LEAGUE WHERE EVERYBODY SPREADS YOU OUT AND THROWS THE
123:23,"SPREADS YOU OUT AND THROWS THE FOOTBALL, ALL OF A SUDDEN"
123:24,"FOOTBALL, ALL OF A SUDDEN THEY'RE SEEING THE WISHBONE BY"
123:26,THEY'RE SEEING THE WISHBONE BY THIS CAROLINA OFFENSE BUT
123:27,THIS CAROLINA OFFENSE BUT THEY'VE BEEN READY FOR IT.
123:28,THEY'VE BEEN READY FOR IT. THEY'VE KEPT CAM NEWTON FROM
123:31,THEY'VE KEPT CAM NEWTON FROM RUNNING BECAUSE OF THAT EXTRA
123:33,RUNNING BECAUSE OF THAT EXTRA WEEK AND OF COURSE THE BIGGEST
123:34,"WEEK AND OF COURSE THE BIGGEST THING OF ALL, THE TALENT AND THE"
123:35,"THING OF ALL, THE TALENT AND THE SPEED."
123:36,SPEED. JIM: STEWART.
123:37,JIM: STEWART. KNOCKED DOWN.
123:38,KNOCKED DOWN. MAYBE A YARD.
123:40,MAYBE A YARD. MARSHALL ON HIM QUICK LITTLE.
123:45,MARSHALL ON HIM QUICK LITTLE. PHIL: TALK ABOUT CAM NEWTON
123:46,PHIL: TALK ABOUT CAM NEWTON RUNNING.
123:47,"RUNNING. REGULAR SEASON, 39.8 YARDS."
123:50,"REGULAR SEASON, 39.8 YARDS. TONIGHT HE'S HAVING A BETTER"
123:52,TONIGHT HE'S HAVING A BETTER NIGHT.
123:53,"NIGHT. THE OTHER THING, WADE PHILLIPS,"
123:55,"THE OTHER THING, WADE PHILLIPS, BEEN IN A LOT OF GAMES."
123:57,"BEEN IN A LOT OF GAMES. HE KNOWS BY BLITZING, IT MAKES"
124:00,"HE KNOWS BY BLITZING, IT MAKES IT MUCH MORE DIFFICULT FOR CAM"
124:02,IT MUCH MORE DIFFICULT FOR CAM NEWTON TO RUN ALSO.
124:04,NEWTON TO RUN ALSO. HE'S DONE THAT IN SOME KEY
124:06,HE'S DONE THAT IN SOME KEY PASSING SITUATIONS.
124:07,PASSING SITUATIONS. HE'S MAKING HIM STAND IN THE
124:09,HE'S MAKING HIM STAND IN THE POCKET AND THROW IT DOWN THE
124:10,POCKET AND THROW IT DOWN THE FIELD.
124:11,FIELD. JIM: SHAQ BARRETT IS BACK IN
124:12,JIM: SHAQ BARRETT IS BACK IN PLAY.
124:13,PLAY. HE'S ON THE FIELD.
124:14,HE'S ON THE FIELD. SECOND AND 10.
124:15,SECOND AND 10. AND A FLAG FIRST.
124:18,"AND A FLAG FIRST. REFEREE: FALSE START, OFFENSE,"
124:21,"REFEREE: FALSE START, OFFENSE, NUMBER 74."
124:22,NUMBER 74. FIVE-YARD PENALTY.
124:23,FIVE-YARD PENALTY. STILL SECOND DOWN.
124:25,STILL SECOND DOWN. JIM: AND THAT'S THE SIXTH
124:28,JIM: AND THAT'S THE SIXTH PRE-SNAP PENALTY NOW ON
124:29,PRE-SNAP PENALTY NOW ON CAROLINA.
124:30,CAROLINA. PHIL: HOW ABOUT THAT?
124:32,"PHIL: HOW ABOUT THAT? WE SAW IT EARLY IN THE GAME,"
124:33,"WE SAW IT EARLY IN THE GAME, REALLY A GAME CHANGER."
124:35,"REALLY A GAME CHANGER. UNDER SO MUCH PRESSURE, WHICH"
124:37,"UNDER SO MUCH PRESSURE, WHICH I'VE WATCHED A LOT OF CAROLINA"
124:39,I'VE WATCHED A LOT OF CAROLINA FOOTBALL GETTING READY FOR THIS
124:41,FOOTBALL GETTING READY FOR THIS GAME AND DURING THE YEAR AND CAM
124:43,GAME AND DURING THE YEAR AND CAM NEWTON GETS AS MUCH TIME TO
124:44,NEWTON GETS AS MUCH TIME TO THROW THE FOOTBALL AS ANY
124:46,THROW THE FOOTBALL AS ANY QUARTERBACK IN THE LEAGUE.
124:47,"QUARTERBACK IN THE LEAGUE. WELL, NOT TONIGHT."
124:48,"WELL, NOT TONIGHT. THE TACKLES, ALL THESE PRE-SNAP"
124:50,"THE TACKLES, ALL THESE PRE-SNAP PENALTIES."
124:50,PENALTIES. WHY?
124:51,WHY? BECAUSE THEY'RE WORRIED ABOUT
124:53,BECAUSE THEY'RE WORRIED ABOUT THE SPEED AROUND THE EDGE.
124:54,THE SPEED AROUND THE EDGE. JIM: SECOND AND 15.
124:55,JIM: SECOND AND 15. THEY SEAL IT THIS TIME.
124:56,THEY SEAL IT THIS TIME. THE BALL IS DEFLECTED AT THE
124:59,THE BALL IS DEFLECTED AT THE LINE OF SCRIMMAGE.
125:00,LINE OF SCRIMMAGE. GETTING A HAND ON IT WAS
125:03,GETTING A HAND ON IT WAS SYLVESTER WILLIAMS.
125:05,SYLVESTER WILLIAMS. PHIL: GOOD THING THAT FOOTBALL
125:06,PHIL: GOOD THING THAT FOOTBALL WAS TIPPED.
125:08,"WAS TIPPED. TRIED TO FIND GREG OLSEN, TOP OF"
125:11,"TRIED TO FIND GREG OLSEN, TOP OF YOUR SCREEN."
125:13,YOUR SCREEN. JUST A PUSH ON THE POCKET.
125:20,JUST A PUSH ON THE POCKET. SYLVESTER WILLIAMS KNOCKS IT
125:21,SYLVESTER WILLIAMS KNOCKS IT DOWN.
125:22,DOWN. LOOK AT T.J. WARD COMING IN
125:23,LOOK AT T.J. WARD COMING IN FRONT OF THE RECEIVER FOR THE
125:25,FRONT OF THE RECEIVER FOR THE INTERCEPTION.
125:27,"INTERCEPTION. JIM: AND AGAIN, CAM DOES NOT"
125:30,"JIM: AND AGAIN, CAM DOES NOT HAVE COREY BROWN TO WORK WITH."
125:33,HAVE COREY BROWN TO WORK WITH. HE'S OUT FOR THE REST OF THE
125:35,HE'S OUT FOR THE REST OF THE GAME WITH A CONCUSSION.
125:36,GAME WITH A CONCUSSION. THIRD AND 15.
125:43,THIRD AND 15. COTCHERY.
125:44,COTCHERY. AND HARRIS KEEPS HIM ABOUT THREE
125:47,AND HARRIS KEEPS HIM ABOUT THREE YARD SHORT OF THE FIRST DOWN.
125:49,"YARD SHORT OF THE FIRST DOWN. PHIL: BOY, REALLY GOOD DEFENSE."
125:51,"PHIL: BOY, REALLY GOOD DEFENSE. SMART BY WADE PHILLIPS."
125:52,"SMART BY WADE PHILLIPS. PLAY IT CONSERVATIVE, MAKE HIM"
125:55,"PLAY IT CONSERVATIVE, MAKE HIM THROW IT UNDERNEATH AND WE'VE"
125:56,THROW IT UNDERNEATH AND WE'VE SEEN THIS ALL NIGHT LONG.
125:58,SEEN THIS ALL NIGHT LONG. WATCH THE HIT.
125:59,"WATCH THE HIT. T.J. WARD, CHRIS HARRIS."
126:02,"T.J. WARD, CHRIS HARRIS. A SMALL DEFENSIVE BACK."
126:06,A SMALL DEFENSIVE BACK. JIM: AND HARRIS HAS BEEN DEALING
126:08,JIM: AND HARRIS HAS BEEN DEALING WITH A TENDER SHOULDER FOR THE
126:10,WITH A TENDER SHOULDER FOR THE PAST THREE WEEKS.
126:12,PAST THREE WEEKS. HE JUST LOWERED IT THAT TIME TO
126:15,HE JUST LOWERED IT THAT TIME TO KNOCK HIM OUT AND FORCE THE
126:17,"KNOCK HIM OUT AND FORCE THE PUNT, AS WE'RE NOW PAST THE"
126:20,"PUNT, AS WE'RE NOW PAST THE HALFWAY POINT OF THE FINAL"
126:21,HALFWAY POINT OF THE FINAL QUARTER.
126:22,QUARTER. FAIR CATCH SIGNAL HERE.
126:24,FAIR CATCH SIGNAL HERE. AND IT'S MADE.
126:25,"AND IT'S MADE. CONTACT WITH HIS OWN MAN, KEO."
126:33,"CONTACT WITH HIS OWN MAN, KEO. 40-YARD PUNT."
126:34,40-YARD PUNT. AND NOW THE BRONCOS HAVE THE
126:36,AND NOW THE BRONCOS HAVE THE FOOTBALL BACK.
126:37,FOOTBALL BACK. SEVEN MINUTES TO GO AND A
126:45,SEVEN MINUTES TO GO AND A JIM: SUPER BOWL 50 ON CBS IS
126:47,JIM: SUPER BOWL 50 ON CBS IS SPONSORED BY --
127:00,JIM: LOOK AT THE GOLDEN GATE
127:02,JIM: LOOK AT THE GOLDEN GATE BRIDGE.
127:03,"BRIDGE. BUT AGAIN, THESE TEAMS STAYED"
127:06,"BUT AGAIN, THESE TEAMS STAYED DOWN IN THE SOUTH BAY AREA."
127:08,DOWN IN THE SOUTH BAY AREA. DENVER PRACTICED AT STANFORD AND
127:12,DENVER PRACTICED AT STANFORD AND SAN JOSE STATE FOR CAROLINA.
127:13,"SAN JOSE STATE FOR CAROLINA. AND NOW ALL THE SEASON, ALL THE"
127:15,"AND NOW ALL THE SEASON, ALL THE GAMES COMING DOWN TO THE LAST"
127:17,GAMES COMING DOWN TO THE LAST SEVEN MINUTES LEADING TO THIS.
127:19,SEVEN MINUTES LEADING TO THIS. FROM THE 25.
127:20,FROM THE 25. THE HANDOFF.
127:24,THE HANDOFF. THAT CAROLINA DEFENSIVE FRONT
127:26,THAT CAROLINA DEFENSIVE FRONT DOESN'T GIVE HILLMAN ANY ROOM AT
127:28,DOESN'T GIVE HILLMAN ANY ROOM AT ALL.
127:29,ALL. LOTULELEI BACKS HIM UP TOO.
127:31,LOTULELEI BACKS HIM UP TOO. THIS IS THE SUMMARY.
127:33,THIS IS THE SUMMARY. YOU'RE LOOKING FOR THE BIG
127:35,"YOU'RE LOOKING FOR THE BIG HIGHLIGHT PLAY -- WELL, YOU HAD"
127:37,"HIGHLIGHT PLAY -- WELL, YOU HAD THE DEFENSIVE TOUCHDOWN EARLY IN"
127:38,THE DEFENSIVE TOUCHDOWN EARLY IN THE GAME FORCED BY VON MILLER.
127:41,THE GAME FORCED BY VON MILLER. 10 SACKS BY TURNOVERS.
127:42,"10 SACKS BY TURNOVERS. 16 PENALTIES, ONE OFFENSIVE"
127:43,"16 PENALTIES, ONE OFFENSIVE TOUCHDOWN FROM A YARD OUT AND 12"
127:46,TOUCHDOWN FROM A YARD OUT AND 12 PUNTS.
127:51,PUNTS. AND COMBINED THE TEAMS ARE 4-25
127:53,AND COMBINED THE TEAMS ARE 4-25 ON THIRD DOWN.
127:56,ON THIRD DOWN. SECOND AND 11.
128:01,SECOND AND 11. THAT'S ANDERSON.
128:04,THAT'S ANDERSON. AGAIN PUTTING UP A FIGHT TO GET
128:06,AGAIN PUTTING UP A FIGHT TO GET EVERY INCH.
128:08,EVERY INCH. LOTULELEI AND MCCLAIN ON THE
128:10,LOTULELEI AND MCCLAIN ON THE TACKLE.
128:11,TACKLE. PHIL: YOU LOOK AT WHAT THEY'RE
128:12,"PHIL: YOU LOOK AT WHAT THEY'RE DOING HERE, TRYING TO GET THAT"
128:14,"DOING HERE, TRYING TO GET THAT ONE FIRST DOWN TO TRY TO RUN"
128:16,ONE FIRST DOWN TO TRY TO RUN THIS CLOCK DOWN.
128:17,"THIS CLOCK DOWN. I THINK SINCE PEYTON MANNING,"
128:19,"I THINK SINCE PEYTON MANNING, WHEN HE GOT HURT, THEY TOOK HIM"
128:21,"WHEN HE GOT HURT, THEY TOOK HIM OUT OF THE LINEUP WAS ALMOST A"
128:24,OUT OF THE LINEUP WAS ALMOST A BLESSING IN DISGUISE.
128:25,"BLESSING IN DISGUISE. FIRST OFF, HE GOT HEALTHY BUT"
128:27,"FIRST OFF, HE GOT HEALTHY BUT THEN I THINK HE GOT A DIFFERENT"
128:29,THEN I THINK HE GOT A DIFFERENT PERSPECTIVE.
128:30,"PERSPECTIVE. HE LOOKS OUT THERE AND KNOWS,"
128:31,"HE LOOKS OUT THERE AND KNOWS, WOW, I SEE WE HAVE A SUPER BOWL"
128:34,"WOW, I SEE WE HAVE A SUPER BOWL DEFENSE AND HE HAS TO PLAY"
128:37,DEFENSE AND HE HAS TO PLAY ACCORDINGLY.
128:41,"ACCORDINGLY. JIM: WELL, YOU HAVE TO WONDER,"
128:43,"JIM: WELL, YOU HAVE TO WONDER, CAN HE MAKE THE BIG THROW NOW ON"
128:45,CAN HE MAKE THE BIG THROW NOW ON THIRD AND 9?
128:46,"THIRD AND 9? NO, HE'S GOING TO RUN IT."
128:49,"NO, HE'S GOING TO RUN IT. GOING BACK TO ANDERSON."
128:51,GOING BACK TO ANDERSON. WHAT'D YOU THINK OF THAT CALL?
128:52,WHAT'D YOU THINK OF THAT CALL? PICKS UP ONE.
128:54,PICKS UP ONE. PAUL: NOT SURPRISED AT ALL.
128:57,"PAUL: NOT SURPRISED AT ALL. I SHOULD HAVE SAID IT, IT"
128:59,"I SHOULD HAVE SAID IT, IT WOULDN'T SURPRISE ME IF THEY RUN"
129:01,WOULDN'T SURPRISE ME IF THEY RUN THE FOOTBALL.
129:03,THE FOOTBALL. BECAUSE DO YOU BELIEVE IF WE
129:05,BECAUSE DO YOU BELIEVE IF WE PUNT THE BALL DOWN THERE THAT
129:07,PUNT THE BALL DOWN THERE THAT CAM NEWTON CAN MARCH HIS TEAM
129:09,CAM NEWTON CAN MARCH HIS TEAM DOWN THE FIELD AND SCORE A
129:11,DOWN THE FIELD AND SCORE A TOUCHDOWN?
129:12,TOUCHDOWN? SO NOT TAKING A CHANCE.
129:13,"SO NOT TAKING A CHANCE. PASS PROTECTION, BALL GET"
129:15,"PASS PROTECTION, BALL GET TIPPED, WHATEVER."
129:17,"TIPPED, WHATEVER. YOU'RE HERE BECAUSE OF YOUR"
129:18,YOU'RE HERE BECAUSE OF YOUR DEFENSE.
129:19,DEFENSE. PUT IT IN THE HANDS OF YOUR
129:21,PUT IT IN THE HANDS OF YOUR DEFENSE.
129:22,DEFENSE. JIM: IT'S BEEN REALLY THEIR
129:23,JIM: IT'S BEEN REALLY THEIR FORMULA ALL POSTSEASON.
129:31,FORMULA ALL POSTSEASON. ALL SEG SEASON AS WELL.
129:32,ALL SEG SEASON AS WELL. A LOT OF HANG TIME WITH THIS ONE
129:35,A LOT OF HANG TIME WITH THIS ONE AND IT BOUNCES OVER THE HEAD OF
129:37,AND IT BOUNCES OVER THE HEAD OF LATIMER AND AWAY FROM GINN AND
129:39,LATIMER AND AWAY FROM GINN AND THEY'LL MARK IT AT THE 24 AND
129:42,THEY'LL MARK IT AT THE 24 AND WE'LL TAKE A LOOK FROM OUR
129:45,WE'LL TAKE A LOOK FROM OUR BUDWEISER SKYCAM INSIDE OF FIVE
129:46,BUDWEISER SKYCAM INSIDE OF FIVE MINUTES TO GO.
129:57,MINUTES TO GO. PHIL: YOU LOOK AT THE TIME ON
129:58,PHIL: YOU LOOK AT THE TIME ON THE CLOCK.
130:00,THE CLOCK. CAROLINA HAS THREE TIME-OUTS.
130:03,"CAROLINA HAS THREE TIME-OUTS. JIM, IT'S ONE OF THOSE"
130:05,"JIM, IT'S ONE OF THOSE SITUATIONS -- WE'LL WAIT AND SEE"
130:07,SITUATIONS -- WE'LL WAIT AND SEE BUT IF THEY GET A FIRST DOWN OR
130:09,BUT IF THEY GET A FIRST DOWN OR TWO THEN IT ALMOST PUTS THEM IN
130:12,TWO THEN IT ALMOST PUTS THEM IN FOUR-DOWN TERRITORY.
130:13,FOUR-DOWN TERRITORY. JIM: CAROLINA HAS ALWAYS FOUND A
130:15,JIM: CAROLINA HAS ALWAYS FOUND A WAY THIS SEASON.
130:17,WAY THIS SEASON. PHIL: THEY HAVE AND IF I WAS
130:20,"PHIL: THEY HAVE AND IF I WAS DENVER'S DEFENSE, MAKE SURE CAM"
130:22,"DENVER'S DEFENSE, MAKE SURE CAM NEWTON ON A PASSING SITUATION IS"
130:24,NEWTON ON A PASSING SITUATION IS NOT ABLE TO FIND THAT RUNNING
130:26,NOT ABLE TO FIND THAT RUNNING LANE AND MOVE TO THROW THE
130:27,LANE AND MOVE TO THROW THE FOOTBALL OR RUN.
130:32,"FOOTBALL OR RUN. JIM: TO THE GROUND, TO TOLBERT."
130:35,"JIM: TO THE GROUND, TO TOLBERT. AND HE'S ABLE TO GET JUST A"
130:37,AND HE'S ABLE TO GET JUST A YARD.
130:43,YARD. PHIL: VON MILLER AGAINST RIVERS.
130:45,PHIL: VON MILLER AGAINST RIVERS. BEAUTIFUL JOB.
130:46,BEAUTIFUL JOB. SPINS INSIDE.
130:47,SPINS INSIDE. LOOK AT THE COVERAGE DOWN THE
130:49,LOOK AT THE COVERAGE DOWN THE FIELD.
130:50,FIELD. NOBODY OPEN ANYWAY AND CAM
130:51,NOBODY OPEN ANYWAY AND CAM NEWTON LOOKING FOR A WAY TO GET
130:53,NEWTON LOOKING FOR A WAY TO GET OUT OF TROUBLE.
130:59,"OUT OF TROUBLE. THAT RUNG PLAY, THEY WERE HOPING"
131:01,"THAT RUNG PLAY, THEY WERE HOPING TO CATCH DENVER SURPRISED."
131:02,TO CATCH DENVER SURPRISED. IT DIDN'T WORK.
131:04,IT DIDN'T WORK. JIM: SECOND AND 9 AND NEWTON'S
131:07,JIM: SECOND AND 9 AND NEWTON'S PASS WIDE OF THE MARK FOR
131:09,PASS WIDE OF THE MARK FOR FUNCHESS.
131:14,FUNCHESS. THE PANTHERS MOVED THIS FOOTBALL
131:17,THE PANTHERS MOVED THIS FOOTBALL IN THAT THIRD QUARTER BUT DIDN'T
131:20,IN THAT THIRD QUARTER BUT DIDN'T SCORE.
131:21,SCORE. AND THE MISSED FIELD GOAL AND
131:22,AND THE MISSED FIELD GOAL AND INTERCEPTION.
131:23,INTERCEPTION. THEY HAD TWO PASS PLAYS OVER 40
131:25,THEY HAD TWO PASS PLAYS OVER 40 YARDS.
131:26,YARDS. PHIL: JUST TO SHOW YOU WHAT
131:27,"PHIL: JUST TO SHOW YOU WHAT THENK OF THEIR TEMPS, THEIR --"
131:29,"THENK OF THEIR TEMPS, THEIR -- THEY THINK OF THEIR DEFENSE."
131:32,"THEY THINK OF THEIR DEFENSE. HERE WE ARE, TOWARDS THE END OF"
131:34,"HERE WE ARE, TOWARDS THE END OF THE GAME."
131:35,THE GAME. WHAT DID DENVER DO?
131:36,"WHAT DID DENVER DO? THEY BLITZED, PUT THE PRESSURE"
131:39,"THEY BLITZED, PUT THE PRESSURE ON THEIR CORNERS."
131:40,ON THEIR CORNERS. THE TIMING WAS RIGHT.
131:42,THE TIMING WAS RIGHT. JIM: IT'S A THIRD AND 9.
131:44,"JIM: IT'S A THIRD AND 9. RUSHING FORWARD, THE BALL COMES"
131:46,"RUSHING FORWARD, THE BALL COMES OUT OF THE HAND OF NEWTON."
131:48,OUT OF THE HAND OF NEWTON. IT'S ON THE GROUND AND STILL ON
131:49,IT'S ON THE GROUND AND STILL ON THE GROUND.
131:51,THE GROUND. PICKED UP BY T.J. WARD AT THE
131:55,PICKED UP BY T.J. WARD AT THE 4-YARD LINE!
131:57,4-YARD LINE! VON MILLER DID IT AGAIN.
132:00,VON MILLER DID IT AGAIN. HE KNOCKED IT OUT OF THE HANDS
132:02,HE KNOCKED IT OUT OF THE HANDS OF NEWTON.
132:13,"OF NEWTON. PHIL: HERE HE COMES, NUMBER 58."
132:16,"PHIL: HERE HE COMES, NUMBER 58. VON MILLER GETS RIVERS ONE MORE"
132:19,VON MILLER GETS RIVERS ONE MORE TIME.
132:20,"TIME. CAM NEWTON DIDN'T FEEL IT,"
132:22,"CAM NEWTON DIDN'T FEEL IT, DIDN'T STEP UP."
132:23,DIDN'T STEP UP. THE FOOTBALL JUST TAKEN OUT OF
132:25,THE FOOTBALL JUST TAKEN OUT OF HIS HAND.
132:29,[CAPTIONING FUNDED BY CBS SPORTS
132:30,[CAPTIONING FUNDED BY CBS SPORTS DIVISION]
132:31,[CAPTIONING PERFORMED BY THE
132:32,"[CAPTIONING PERFORMED BY THE NATIONAL CAPTIONING INSTITUTE,"
132:33,"NATIONAL CAPTIONING INSTITUTE, WHICH IS RESPONSIBLE FOR ITS"
132:35,WHICH IS RESPONSIBLE FOR ITS CAPTION CONTENT AND ACCURACY.
132:36,CAPTION CONTENT AND ACCURACY. VISIT NCICAP.ORG]
132:37,PHIL: CAM NEWTON DECIDES NOT TO
132:38,PHIL: CAM NEWTON DECIDES NOT TO DIVE IN THERE.
132:39,DIVE IN THERE. JIM: HE JUMPED AWAY INSTEAD OF
132:41,JIM: HE JUMPED AWAY INSTEAD OF JUMPING INTO THE PILE.
132:42,JUMPING INTO THE PILE. PHIL: I GUESS HE MADE A DECISION
132:44,PHIL: I GUESS HE MADE A DECISION IT WASN'T WORTH TO IT GO IN AND
132:46,IT WASN'T WORTH TO IT GO IN AND GET IT.
132:48,GET IT. SHOULD HAVE DOVE IN
132:49,SHOULD HAVE DOVE IN JIM: FIRST AND GOAL FROM THE 4.
132:51,JIM: FIRST AND GOAL FROM THE 4. ANDERSON TRYING TO BREAK OUTSIDE
132:53,ANDERSON TRYING TO BREAK OUTSIDE BUT THAT SWARMING DEFENSE IS ON
132:54,BUT THAT SWARMING DEFENSE IS ON HIM.
132:55,HIM. LOSS OF TWO.
132:56,LOSS OF TWO. PHIL: THERE'S NO QUESTION
132:57,PHIL: THERE'S NO QUESTION THEY'RE GOING TO RUN THE
132:58,"THEY'RE GOING TO RUN THE FOOTBALL HERE THREE TIMES, JUST"
133:00,"FOOTBALL HERE THREE TIMES, JUST WORK THE CLOCK."
133:01,"WORK THE CLOCK. KICK A FIELD GOAL, PUT YOU UP"
133:03,"KICK A FIELD GOAL, PUT YOU UP TWO SCORES."
133:04,TWO SCORES. AND VON MILLER --
133:05,AND VON MILLER -- JIM: HE'S PICKED UP RIGHT WHERE
133:08,JIM: HE'S PICKED UP RIGHT WHERE HE LEFT OFF AGAINST NEW ENGLAND.
133:10,HE LEFT OFF AGAINST NEW ENGLAND. FAVRE ITS THERE WAS NO WAY
133:11,FAVRE ITS THERE WAS NO WAY AGAINST THIS OFFENSIVE LINE.
133:13,AGAINST THIS OFFENSIVE LINE. THE CROWD NOISE WOULDN'T BE
133:14,THE CROWD NOISE WOULDN'T BE THERE.
133:15,THERE. WORRIED ABOUT ALL THE RUNS WITH
133:16,WORRIED ABOUT ALL THE RUNS WITH CAM NEWTON.
133:18,CAM NEWTON. WRONG.
133:19,"WRONG. VON MILLER, DEMARCUS WARE, THE"
133:23,"VON MILLER, DEMARCUS WARE, THE PASS RUSH HAS BEEN YOUTH"
133:24,PASS RUSH HAS BEEN YOUTH STANDING.
133:26,"STANDING. VON MILLER, YOU HAVE TO LOOK AT"
133:27,"VON MILLER, YOU HAVE TO LOOK AT HIM AND SAY IF THEY WIN THIS"
133:29,"HIM AND SAY IF THEY WIN THIS GAME, HE'S GOT TO BE THE MOST"
133:31,"GAME, HE'S GOT TO BE THE MOST VALUABLE PLAYER."
133:32,VALUABLE PLAYER. JIM: NO QUESTION.
133:33,JIM: NO QUESTION. SECOND AND GOAL FROM THE 6.
133:35,SECOND AND GOAL FROM THE 6. HANDOFF TO ANDERSON AND HE'S
133:36,HANDOFF TO ANDERSON AND HE'S CHURNING DOWN TO ABOUT THE 4.
133:40,CHURNING DOWN TO ABOUT THE 4. AND A TIME-OUT IS CALLED BY
133:42,AND A TIME-OUT IS CALLED BY CAROLINA.
133:43,CAROLINA. SO HERE'S THE FUMBLE.
133:45,SO HERE'S THE FUMBLE. KNOCKED OUT OF HIS HANDS BY
133:46,KNOCKED OUT OF HIS HANDS BY MILLER AND THEN INSTEAD OF GOING
133:48,MILLER AND THEN INSTEAD OF GOING IN THERE AND CHALLENGING WARE
133:51,"IN THERE AND CHALLENGING WARE FOR THE FOOTBALL, HE STEPPED"
133:52,"FOR THE FOOTBALL, HE STEPPED BACK AND THE BALL SQUIRTS ALL"
133:54,BACK AND THE BALL SQUIRTS ALL THE WAY DOWN INSIDE 5.
133:56,"THE WAY DOWN INSIDE 5. AND WARD COMES AWAY WITH IT, HIS"
133:59,"AND WARD COMES AWAY WITH IT, HIS SECOND TAKEAWAY."
134:00,SECOND TAKEAWAY. A PICK AND A FUMBLE RECOVERY IN
134:02,A PICK AND A FUMBLE RECOVERY IN THE GAME FOR WARD.
134:05,THE GAME FOR WARD. PHIL: DID HE THINK IT WAS GOING
134:07,PHIL: DID HE THINK IT WAS GOING TO BE AN INCOMPLETE PASS?
134:09,TO BE AN INCOMPLETE PASS? I DON'T THINK SO.
134:10,I DON'T THINK SO. I JUST THINK HE DECIDED NOT TO
134:12,I JUST THINK HE DECIDED NOT TO TAKE THE CHANCE TO GET THAT
134:13,TAKE THE CHANCE TO GET THAT RECOVERY.
134:16,"RECOVERY. WELL, LOOK AT THE Q.B. HITS HERE"
134:18,"WELL, LOOK AT THE Q.B. HITS HERE TONIGHT."
134:20,"TONIGHT. YOU KNOW, JIM, WHEN YOU SEE THAT"
134:22,"YOU KNOW, JIM, WHEN YOU SEE THAT FOOTBALL ON THE GROUND NO MATTER"
134:24,"FOOTBALL ON THE GROUND NO MATTER WHAT THE SITUATION IS, WHERE IT"
134:25,"WHAT THE SITUATION IS, WHERE IT IS DURING THE SEASON BUT"
134:26,"IS DURING THE SEASON BUT ESPECIALLY THE SUPER BOWL, YOU"
134:28,"ESPECIALLY THE SUPER BOWL, YOU HAVE TO GET IN THERE AND GET"
134:30,HAVE TO GET IN THERE AND GET THAT RECOVERY.
134:31,THAT RECOVERY. BECAUSE NOT GETTING THAT
134:33,BECAUSE NOT GETTING THAT RECOVERY ALMOST TAKES YOUR
134:36,RECOVERY ALMOST TAKES YOUR CHANCES TO WIN THIS FOOTBALL
134:38,CHANCES TO WIN THIS FOOTBALL GAME AWAY.
134:39,GAME AWAY. JIM: THIRD AND GOAL.
134:46,JIM: THIRD AND GOAL. HE'S GOING TO GO UP TOP AND
134:48,HE'S GOING TO GO UP TOP AND THROW IT THROUGH THE BACK OF THE
134:49,THROW IT THROUGH THE BACK OF THE END ZONE BUT IT GENERATES A FLAG
134:51,END ZONE BUT IT GENERATES A FLAG ON THE CAROLINA DEFENSE.
134:54,ON THE CAROLINA DEFENSE. HOLDING ON TO DEMARYIUS THOMAS.
135:05,"HOLDING ON TO DEMARYIUS THOMAS. REFEREE: PRIOR TO THE PASS,"
